id,date,text
3010,2025-11-25 05:26:19+00:00,"🟢 **Відбій повітряної тривоги!**

25.11.2025, 07:26:06 ⏱️ 33 хв."
3009,2025-11-25 04:52:57+00:00,"🔴 **Повітряна тривога❗️**
Зліт ✈️ МіГ-31К[инджал]

25.11.2025, 06:52:45"
3008,2025-11-24 23:51:20+00:00,"🟢 **Відбій повітряної тривоги!**

25.11.2025, 01:51:19 ⏱️ 48 хв."
3007,2025-11-24 23:03:19+00:00,"🔴 **Повітряна тривога❗️**
Зліт ✈️ МіГ-31К[инджал]

25.11.2025, 01:03:16"
3006,2025-11-24 10:11:27+00:00,Зліт ✈️ МіГ-31К[инджал]
3005,2025-11-19 09:07:33+00:00,"🟢 **Відбій повітряної тривоги!**

19.11.2025, 11:07:17 ⏱️ 37 хв."
3004,2025-11-19 08:49:42+00:00,Курс західний
3003,2025-11-19 08:29:52+00:00,"🔴 **Повітряна тривога❗️**
Зліт ✈️ МіГ-31К[инджал]
ймовірно був пуск

19.11.2025, 10:29:48"
3002,2025-11-19 02:03:47+00:00,"🔴 **Повітряна тривога❗️**

19.11.2025, 04:03:45

07:59 Відбій тривоги"
3001,2025-11-14 19:51:37+00:00,"🟢 **Відбій повітряної тривоги!**

14.11.2025, 21:51:35 ⏱️ 28 хв."
3000,2025-11-14 19:23:27+00:00,"🔴 **Повітряна тривога❗️**
Зліт ✈️ МіГ-31К[инджал]

14.11.2025, 21:23:21"
2999,2025-11-13 23:22:43+00:00,"🟢 **Відбій повітряної тривоги!**

14.11.2025, 01:22:31 ⏱️ 53 хв."
2998,2025-11-13 22:29:38+00:00,"🔴 **Повітряна тривога❗️**
Зліт ✈️ МіГ-31К[инджал]

14.11.2025, 00:29:31"
2997,2025-11-09 23:00:16+00:00,"🟢 **Відбій повітряної тривоги!**

10.11.2025, 01:00:10 ⏱️ 25 хв."
2996,2025-11-09 22:34:57+00:00,"🔴 **Повітряна тривога❗️**
Зліт ✈️ МіГ-31К[инджал]

10.11.2025, 00:34:50"
2995,2025-11-09 22:33:57+00:00,"⚠УВАГА
🚨 Вся Україна - ракетна небезпека!
🛫 Зафіксовано зліт МіГ-31К"
2994,2025-11-07 22:18:03+00:00,"🟢 **Відбій повітряної тривоги!**

08.11.2025, 00:17:02 ⏱️ 51 хв."
2993,2025-11-07 21:26:13+00:00,"⚠УВАГА
🚨 Вся Україна - ракетна небезпека!
🛫 Зафіксовано зліт МіГ-31К."
2992,2025-11-07 21:26:05+00:00,"🚀КР ""Калібр"" через Херсонщину у напрямку Миколаївщини."
2991,2025-11-07 21:26:00+00:00,"🔴 **Повітряна тривога❗️**


07.11.2025, 23:25:55"
2990,2025-11-06 15:03:39+00:00,"🟢 **Відбій повітряної тривоги!**

06.11.2025, 17:03:36 ⏱️ 19 хв."
2989,2025-11-06 14:44:15+00:00,"🔴 **Повітряна тривога❗️**
Зліт ✈️ МіГ-31К[инджал]

06.11.2025, 16:44:14"
2988,2025-11-06 14:42:33+00:00,"⚠УВАГА
🚨 Вся Україна - ракетна небезпека!
🛫 Зафіксовано зліт МіГ-31К."
2987,2025-11-06 09:27:21+00:00,"🟢 **Відбій повітряної тривоги!**

06.11.2025, 11:27:17 ⏱️ 22 хв."
2986,2025-11-06 09:05:11+00:00,"🔴 **Повітряна тривога❗️**
Зліт ✈️ МіГ-31К[инджал]

06.11.2025, 11:05:00"
2985,2025-11-02 22:07:41+00:00,"🟢 **Відбій повітряної тривоги!**

03.11.2025, 00:07:33 ⏱️ 31 хв."
2984,2025-11-02 21:36:38+00:00,"🔴 **Повітряна тривога❗️**
Зліт ✈️ МіГ-31К[инджал]

02.11.2025, 23:36:32"
2983,2025-11-02 21:35:21+00:00,Зліт МіГ 31К. Пуск кинджалу.
2982,2025-10-30 07:00:47+00:00,"🟢 **Відбій повітряної тривоги!**

30.10.2025, 09:00:17 ⏱️ 4 год. 31 хв."
2981,2025-10-30 02:28:32+00:00,"🔴 **Повітряна тривога❗️**
Загроза бпла

30.10.2025, 04:28:28"
2980,2025-10-27 16:52:19+00:00,"🟢 **Відбій повітряної тривоги!**

27.10.2025, 18:52:15 ⏱️ 16 хв."
2979,2025-10-27 16:35:52+00:00,"🔴 **Повітряна тривога❗️**
Зліт ✈️ МіГ-31К[инджал]

27.10.2025, 18:35:47"
2978,2025-10-25 01:29:04+00:00,"🟢 **Відбій повітряної тривоги!**

25.10.2025, 04:29:02 ⏱️ 25 хв."
2977,2025-10-25 01:03:23+00:00,"🔴 **Повітряна тривога❗️**
Загроза балістики 🚀

25.10.2025, 04:03:19"
2976,2025-10-22 06:19:40+00:00,"🟢 **Відбій повітряної тривоги!**

22.10.2025, 09:19:33 ⏱️ 2 год. 16 хв."
2975,2025-10-22 04:03:07+00:00,"🔴 **Повітряна тривога❗️**
Зліт ✈️ МіГ-31К[инджал]
Були пуски на столицю. 
Захід чисто.

22.10.2025, 07:03:03"
2974,2025-10-20 09:44:12+00:00,"🟢 **Відбій повітряної тривоги!**

20.10.2025, 12:44:07 ⏱️ 24 хв."
2973,2025-10-20 09:19:37+00:00,"🔴 **Повітряна тривога❗️**
Зліт МіГ 31К

20.10.2025, 12:19:35"
2972,2025-10-16 03:43:59+00:00,"🟢 **Відбій повітряної тривоги!**

16.10.2025, 06:43:55 ⏱️ 24 хв."
2971,2025-10-16 03:19:36+00:00,"🔴 **Повітряна тривога❗️**
Зліт МіГ 31К

16.10.2025, 06:19:30"
2970,2025-10-16 03:02:03+00:00,"🟢 **Відбій повітряної тривоги!**

16.10.2025, 06:02:02 ⏱️ 42 хв."
2969,2025-10-16 02:19:22+00:00,"🔴 **Повітряна тривога❗️**
Зліт МіГ 31К

16.10.2025, 05:19:15"
2968,2025-10-14 08:50:50+00:00,"🟢 **Відбій повітряної тривоги!**

14.10.2025, 11:50:49 ⏱️ 23 хв."
2967,2025-10-14 08:27:33+00:00,"🔴 **Повітряна тривога❗️**
Зліт МіГ 31К

14.10.2025, 11:27:29"
2966,2025-10-10 03:57:53+00:00,"🟢 **Відбій повітряної тривоги!**

10.10.2025, 06:57:39 ⏱️ 33 хв."
2965,2025-10-10 03:24:16+00:00,"🔴 **Повітряна тривога❗️**
✈️ МіГ-31К[инджал]

10.10.2025, 06:24:10"
2964,2025-10-10 02:51:22+00:00,"🟢 **Відбій повітряної тривоги!**

10.10.2025, 05:51:14 ⏱️ 58 хв."
2963,2025-10-10 01:53:10+00:00,"🔴 **Повітряна тривога❗️**
✈️ МіГ-31К[инджал]

10.10.2025, 04:53:04"
2962,2025-10-05 11:14:07+00:00,"⚡️ ЗБИТО/ПОДАВЛЕНО 478 ЦІЛЕЙ ПРОТИВНИКА
➖➖➖➖➖➖➖➖➖➖
У ніч на 05 жовтня (із 20.00 4 жовтня) противник завдав комбінованого удару по території України із застосуванням ударних БпЛА, ракет повітряного, морського та наземного базування. Загалом радіотехнічними військами Повітряних Сил виявлено та здійснено супровід 549 засобів повітряного нападу:

- 496 ударних БпЛА типу Shahed, Гербера (безпілотники інших типів) із напрямків Курськ, Брянськ, Міллерово, Орел, Шаталово, Приморсько-Ахтарськ – рф, Кача - ТОТ Криму, близько 250 із них – ""шахеди"";
- 2 аеробалістичних ракет Х-47М2 ""Кинджал"" із повітряного простору Липецької обл. - рф;
- 42 крилатих ракети Х-101/Іскандер-К (райони пусків: Самарська, Курська, Брянська обл. - рф);
- 9 крилатих ракет ""Калібр"" із акваторії Чорного моря.

❗️Основний напрямок удару – Львівщина.

Повітряний напад відбивали авіація, зенітні ракетні війська, підрозділи РЕБ та безпілотних систем, мобільні вогневі групи Сил оборони України.

💥 За попередніми даними, станом на 14.00, протиповітряною обороною збито/подавлено 478 повітряних цілей:

- 439 ворожих БпЛА типу Shahed, Гербера (безпілотники інших типів);
- 1 аеробалістичну ракету Х-47 М2 ""Кинджал"";
- 32 крилаті ракети Х-101/Іскандер-К;
- 6 крилатих ракет ""Калібр"".
 
*Крім того, шість ворожих ракет не досягли своїх цілей (локаційно втрачені, місця падіння уточнюються). 

Зафіксовано прямі влучання 8 ракет та 57 ударних БпЛА на 20 локаціях, а також падіння збитих (уламки) на 6 локаціях.

✊ Тримаймо небо!
🇺🇦 Разом – до перемоги!"
2961,2025-10-05 06:01:22+00:00,"🟢 **Відбій повітряної тривоги!**

05.10.2025, 09:00:37 ⏱️ 5 год. 10 хв."
2960,2025-10-05 04:13:33+00:00,КР мінус. Загроза ударних БпЛА залишається.
2959,2025-10-05 03:53:31+00:00,🚀Львів! Ще група ракет на місто!
2958,2025-10-05 03:48:06+00:00,"По факту, Львів!"
2957,2025-10-05 03:45:34+00:00,"Надалі триває мопедна небезпека + групи крилатих ракет Ту-95 залітають з сусідніх областей. Стрий, будьте уважні!"
2956,2025-10-05 03:33:44+00:00,!!!
2955,2025-10-05 03:31:37+00:00,"Ймовірно, 2 х Кинджали на Львівщину."
2954,2025-10-05 03:04:10+00:00,Зліт ✈️ МіГ-31К[инджал]
2953,2025-10-05 02:24:40+00:00,Ракети тримають курс ➡️ на Львів!
2952,2025-10-05 01:27:33+00:00,"Львів, будьмо уважні!"
2951,2025-10-05 00:50:23+00:00,"🔴 **Повітряна тривога❗️**
Загроза ударних БпЛА

05.10.2025, 03:50:20"
2950,2025-10-03 18:16:03+00:00,"🟢 **Відбій повітряної тривоги!**

03.10.2025, 21:15:54 ⏱️ 31 хв."
2949,2025-10-03 17:44:38+00:00,"🔴 **Повітряна тривога❗️**
✈️ МіГ-31К[инджал]

03.10.2025, 20:44:36"
2948,2025-09-30 11:12:28+00:00,"**Допомогти може кожен!**

🍂 Настала осінь, листя опадає — техніку та позиції стає ще складніше приховувати від ворога. Потрібні  маскувальні сітки!

🧶 **Матеріали для плетіння є — потрібні лише ваші руки.**
Кожна ваша година допоможе швидше закрити потребу наших захисників. ✋❤️

🕘 **Коли:** щодня, **09:00–22:00**
📍 **Де:** студентська бібліотека Львівської Політехніки, вул. Митрополита Андрея, 3

📞 **Контактна особа:** 
+380 67 672 51 94 — Ірина
[Facebook](https://www.facebook.com/sprava.gromad.lviv)"
2947,2025-09-28 03:52:46+00:00,"🟢 **Відбій повітряної тривоги!**

28.09.2025, 06:52:39 ⏱️ 1 год. 16 хв."
2946,2025-09-28 02:36:41+00:00,"🔴 **Повітряна тривога❗️**
Ракетна небезпека 

28.09.2025, 05:36:34"
2945,2025-09-28 00:08:00+00:00,"🟢 **Відбій повітряної тривоги!**

28.09.2025, 03:07:55 ⏱️ 40 хв."
2944,2025-09-27 23:27:24+00:00,"🔴 **Повітряна тривога❗️**
**UPD 02:30: на Львівщині чисто, без нових загроз.**

28.09.2025, 02:27:21"
2943,2025-09-27 23:26:19+00:00,"✈️ Зліт МіГ-31К[инджал]
Відбувся пуск. Ймовірно, Старкон (Хмельницька обл)"
2942,2025-09-27 21:35:24+00:00,🔮 Ймовірна загроза ракетного удару після 4 год ранку. Активна стратегічна авіація ворога (Ту-95МС).
2941,2025-09-20 03:54:23+00:00,"🟢 **Відбій повітряної тривоги!**

20.09.2025, 06:54:18 ⏱️ 1 год. 8 хв."
2940,2025-09-20 03:44:50+00:00,Чисто.
2939,2025-09-20 03:35:03+00:00,"Курсом на Стрий, Львівщина."
2938,2025-09-20 03:34:32+00:00,🚀  Будьмо уважні!
2937,2025-09-20 03:29:21+00:00,"🚀 Крилаті ракети на півночі Тернопільщини, курсом на захід."
2936,2025-09-20 02:46:21+00:00,"🔴 **Повітряна тривога❗️**
Загроза ракетного удару.

Перші КР з Тушок курсом на Київщину.

20.09.2025, 05:46:10"
2935,2025-09-11 08:14:43+00:00,"🟢 **Відбій повітряної тривоги!**

11.09.2025, 11:14:32 ⏱️ 15 хв."
2934,2025-09-11 07:59:10+00:00,"🔴 **Повітряна тривога❗️**
✈️ МіГ-31К[инджал]

11.09.2025, 10:59:08"
2933,2025-09-10 04:08:48+00:00,"🟢 **Відбій повітряної тривоги!**

10.09.2025, 07:08:44 ⏱️ 1 год. 32 хв."
2932,2025-09-10 02:36:23+00:00,"🔴 **Повітряна тривога❗️**
Ракетна небезпека + Загроза ударних БпЛА.

10.09.2025, 05:36:21"
2931,2025-09-10 01:25:33+00:00,"🟢 **Відбій повітряної тривоги!**

10.09.2025, 04:25:29 ⏱️ 2 год. 18 хв."
2930,2025-09-10 00:23:16+00:00,Будьмо уважні!
2929,2025-09-09 23:07:07+00:00,"🔴 **Повітряна тривога❗️**
Загроза ударних БпЛА.

10.09.2025, 02:06:57"
2928,2025-09-07 03:35:39+00:00,"🟢 **Відбій повітряної тривоги!**

07.09.2025, 06:35:28 ⏱️ 31 хв."
2927,2025-09-07 03:04:34+00:00,"🔴 **Повітряна тривога❗️**
Загроза ракетного удару

07.09.2025, 06:04:27"
2926,2025-09-06 11:54:33+00:00,"🟢 **Відбій повітряної тривоги!**

06.09.2025, 14:54:23 ⏱️ 20 хв."
2925,2025-09-06 11:34:15+00:00,"🔴 **Повітряна тривога❗️**
✈️ МіГ-31К[инджал]

06.09.2025, 14:34:07"
2924,2025-09-03 03:45:47+00:00,"🟢 **Відбій повітряної тривоги!**

03.09.2025, 06:45:38 ⏱️ 2 год. 2 хв."
2923,2025-09-03 01:42:41+00:00,"🔴 **Повітряна тривога❗️**
Загроза ракетних ударів
кр з тушок підлетіли + калібри з моря

03.09.2025, 04:42:40"
2922,2025-09-03 00:43:57+00:00,"🟢 **Відбій повітряної тривоги!**

03.09.2025, 03:43:54 ⏱️ 2 год. 58 хв."
2921,2025-09-02 21:45:21+00:00,"🔴 **Повітряна тривога❗️**
Загроза ударних БпЛА

03.09.2025, 00:45:15"
2920,2025-09-01 07:40:50+00:00,"🟢 **Відбій повітряної тривоги!**

01.09.2025, 10:40:44 ⏱️ 21 хв."
2919,2025-09-01 07:19:01+00:00,"🔴 **Повітряна тривога❗️**
✈️ МіГ-31К[инджал]

01.09.2025, 10:19:00"
2918,2025-09-01 07:18:52+00:00,✈️ МіГ-31К[инджал]
2917,2025-08-30 03:08:09+00:00,"🟢 **Відбій повітряної тривоги!**

30.08.2025, 06:08:03 ⏱️ 3 год. 19 хв."
2916,2025-08-29 23:49:01+00:00,"🔴 **Повітряна тривога❗️**


30.08.2025, 02:48:58"
2915,2025-08-28 03:20:06+00:00,"🟢 **Відбій повітряної тривоги!**

28.08.2025, 06:19:54 ⏱️ 49 хв."
2914,2025-08-28 02:30:26+00:00,"🔴 **Повітряна тривога❗️**
Загроза ракетного удару 

28.08.2025, 05:30:24"
2913,2025-08-28 02:13:48+00:00,"🟢 **Відбій повітряної тривоги!**

28.08.2025, 05:13:37 ⏱️ 1 год. 49 хв."
2912,2025-08-28 00:24:06+00:00,"🔴 **Повітряна тривога❗️**
Загроза балістики (знов)

28.08.2025, 03:24:04"
2911,2025-08-27 23:34:09+00:00,"Проте ніч обіцяє бути неспокійною. 
Шахеди вже у сусідніх областях (Ів.Ф, Терн., Рівн.). До години часу можуть бути на Львівщині. + пару Тушок у повітрі теж на ранок можуть нагадатись."
2910,2025-08-27 23:26:52+00:00,"🟢 **Відбій повітряної тривоги!**

28.08.2025, 02:26:43 ⏱️ 9 хв."
2909,2025-08-27 23:18:32+00:00,Наразі все чисто.
2908,2025-08-27 23:17:09+00:00,"🔴 **Повітряна тривога❗️**
**Загроза балістики з Північного Сходу**

28.08.2025, 02:17:05"
2907,2025-08-21 03:48:00+00:00,"🟢 **Відбій повітряної тривоги!**

21.08.2025, 06:47:56 ⏱️ 3 год. 57 хв."
2906,2025-08-21 03:06:22+00:00,"КР курсом на Львів , будь мо уважні !"
2905,2025-08-21 02:04:22+00:00,"На даний час безпосередніх загроз не фіксується, але тривога триває, у сусідніх областях чимало шахедів і приблизно за годину можливий підльот  КР з тушок."
2904,2025-08-21 01:44:12+00:00,"Львів, будьмо уважні! Кілька шахедів у області.  Може бути гучно."
2903,2025-08-20 23:50:12+00:00,"🔴 **Повітряна тривога❗️**
✈️ МіГ-31К[инджал]

21.08.2025, 02:50:11"
2902,2025-08-20 09:47:38+00:00,"🟢 **Відбій повітряної тривоги!**

20.08.2025, 12:47:28 ⏱️ 27 хв."
2901,2025-08-20 09:37:29+00:00,"Фіксувалось 🛸 на півночі західних областей вектором на південь, зникло."
2900,2025-08-20 09:20:36+00:00,"🔴 **Повітряна тривога❗️**
✈️ МіГ-31К[инджал]

20.08.2025, 12:20:25"
2899,2025-08-19 22:25:57+00:00,"🟢 **Відбій повітряної тривоги!**

20.08.2025, 01:25:48 ⏱️ 1 год. 5 хв."
2898,2025-08-19 21:20:10+00:00,"🔴 **Повітряна тривога❗️**
Загроза ударних БпЛА

20.08.2025, 00:20:03"
2897,2025-08-18 16:38:26+00:00,"🟢 **Відбій повітряної тривоги!**

18.08.2025, 19:38:17 ⏱️ 16 хв."
2896,2025-08-18 16:21:37+00:00,"🔴 **Повітряна тривога❗️**
✈️ МіГ-31К[инджал]

18.08.2025, 19:21:30"
2895,2025-08-18 16:21:35+00:00,✈️ МіГ-31К[инджал]
2894,2025-08-15 16:44:32+00:00,"🟢 **Відбій повітряної тривоги!**

15.08.2025, 19:44:27 ⏱️ 11 хв."
2893,2025-08-15 16:32:37+00:00,"🔴 **Повітряна тривога❗️**
✈️ МіГ-31К[инджал]

15.08.2025, 19:32:28"
2892,2025-08-13 17:56:02+00:00,False positive. Все спокійно. Загрози на даний час відсутні.
2891,2025-08-13 17:51:15+00:00,🚨
2890,2025-08-11 11:08:13+00:00,"🟢 **Відбій повітряної тривоги!**

11.08.2025, 14:08:07 ⏱️ 14 хв."
2889,2025-08-11 10:53:39+00:00,"🔴 **Повітряна тривога❗️**
✈️ МіГ-31К[инджал]

11.08.2025, 13:53:37"
2888,2025-08-04 14:56:52+00:00,"🔮 тривожно! 

У найближчі дні можлива масована повітряна атака.

Що відомо наразі:
 • На аеродромах “Оленья” та “Енгельс” перебувають 6 споряджених Ту-95МС і щонайменше 2 Ту-160.
 • У “Енгельсі” та “Моздоку” розміщені 4 Ту-22М3.
 • У Новоросійську на бойовому чергуванні перебувають 4 ракетоносії із загальним потенційним залпом до 32 ракет типу “Калібр”."
2887,2025-08-04 09:12:58+00:00,"🟢 **Відбій повітряної тривоги!**

04.08.2025, 12:12:55 ⏱️ 26 хв."
2886,2025-08-04 08:46:39+00:00,"🔴 **Повітряна тривога❗️**
✈️ МіГ-31К[инджал]

04.08.2025, 11:46:31"
2885,2025-08-04 07:28:52+00:00,"🟢 **Відбій повітряної тривоги!**

04.08.2025, 10:28:43 ⏱️ 26 хв."
2884,2025-08-04 07:02:45+00:00,"🔴 **Повітряна тривога❗️**
✈️ МіГ-31К[инджал]

04.08.2025, 10:02:40"
2883,2025-08-04 06:38:08+00:00,"🟢 **Відбій повітряної тривоги!**

04.08.2025, 09:37:57 ⏱️ 42 хв."
2882,2025-08-04 05:55:44+00:00,"🔴 **Повітряна тривога❗️**
Пуск Кинджалу – Хмельниччина! 
✈️ МіГ-31К[инджал]

04.08.2025, 08:55:33"
2881,2025-08-02 15:45:04+00:00,"🟢 **Відбій повітряної тривоги!**

02.08.2025, 18:45:03 ⏱️ 24 хв."
2880,2025-08-02 15:20:28+00:00,"🔴 **Повітряна тривога❗️**
Ймовірний пуск Кинджалу!

02.08.2025, 18:20:21"
2879,2025-08-02 15:19:40+00:00,✈️ МіГ-31К[инджал]
2878,2025-07-31 18:24:10+00:00,"🟢 **Відбій повітряної тривоги!**

31.07.2025, 21:23:59 ⏱️ 14 хв."
2877,2025-07-31 18:09:58+00:00,"🔴 **Повітряна тривога❗️**
✈️ МіГ-31К[инджал]

31.07.2025, 21:09:55"
2876,2025-07-31 11:12:49+00:00,"🟢 **Відбій повітряної тривоги!**

31.07.2025, 14:12:39 ⏱️ 15 хв."
2875,2025-07-31 10:57:07+00:00,"🔴 **Повітряна тривога❗️**
✈️ МіГ-31К[инджал]

31.07.2025, 13:57:06"
2874,2025-07-30 13:25:52+00:00,"🟢 **Відбій повітряної тривоги!**

30.07.2025, 16:25:39 ⏱️ 27 хв."
2873,2025-07-30 12:57:55+00:00,"🔴 **Повітряна тривога❗️**
✈️ МіГ-31К[инджал]

30.07.2025, 15:57:45"
2872,2025-07-28 06:15:04+00:00,"🟢 **Відбій повітряної тривоги!**

28.07.2025, 09:14:56 ⏱️ 27 хв."
2871,2025-07-28 05:47:49+00:00,"🔴 **Повітряна тривога❗️**
✈️ МіГ-31К[инджал]

28.07.2025, 08:47:47"
2870,2025-07-28 05:20:56+00:00,"🟢 **Відбій повітряної тривоги!**

28.07.2025, 08:20:47 ⏱️ 28 хв."
2869,2025-07-28 04:52:10+00:00,"🔴 **Повітряна тривога❗️**
✈️ МіГ-31К[инджал]

28.07.2025, 07:52:03"
2868,2025-07-28 01:42:42+00:00,"🟢 **Відбій повітряної тривоги!**

28.07.2025, 04:42:34 ⏱️ 43 хв."
2867,2025-07-28 00:59:11+00:00,"🔴 **Повітряна тривога❗️**
Загроза ракетних ударів

28.07.2025, 03:59:06"
2866,2025-07-27 20:28:51+00:00,"🔮 тривожно. 
Активність стратегічної авіації (Ту-95МС) + трохи є шахедів (найближчі вже на Житомирщині)."
2865,2025-07-25 11:05:27+00:00,"🟢 **Відбій повітряної тривоги!**

25.07.2025, 14:05:21 ⏱️ 14 хв."
2864,2025-07-25 10:50:53+00:00,"🔴 **Повітряна тривога❗️**
✈️ МіГ-31К[инджал]

25.07.2025, 13:50:44"
2863,2025-07-24 13:10:13+00:00,"🟢 **Відбій повітряної тривоги!**

24.07.2025, 16:10:07 ⏱️ 22 хв."
2862,2025-07-24 12:47:42+00:00,"🔴 **Повітряна тривога❗️**
✈️ МіГ-31К[инджал]

24.07.2025, 15:47:41"
2861,2025-07-21 04:45:52+00:00,"🟢 **Відбій повітряної тривоги!**

21.07.2025, 07:45:48 ⏱️ 10 хв."
2860,2025-07-21 04:35:06+00:00,"🔴 **Повітряна тривога❗️**
Загроза БпЛА 🛵

21.07.2025, 07:34:53"
2858,2025-07-21 04:22:48+00:00,"🟢 **Відбій повітряної тривоги!**

21.07.2025, 07:22:46 ⏱️ 37 хв."
2857,2025-07-21 03:45:00+00:00,"🔴 **Повітряна тривога❗️**
Загроза БпЛА 🛵

21.07.2025, 06:44:52"
2856,2025-07-21 03:19:31+00:00,"🟢 **Відбій повітряної тривоги!**

21.07.2025, 06:19:18 ⏱️ 25 хв."
2855,2025-07-21 02:58:50+00:00,Кинджал на Івано-Франківськ!
2854,2025-07-21 02:53:35+00:00,"🔴 **Повітряна тривога❗️**
✈️ МіГ-31К[инджал]

21.07.2025, 05:53:24"
2853,2025-07-21 02:53:34+00:00,✈️ МіГ-31К[инджал]
2852,2025-07-21 02:49:51+00:00,"🟢 **Відбій повітряної тривоги!**

21.07.2025, 05:49:43 ⏱️ 2 год. 50 хв."
2851,2025-07-20 23:59:07+00:00,"🔴 **Повітряна тривога❗️**
Загроза ракетного удару
~~Кинджал~~, ~~калібри на Вінниччині.~~

21.07.2025, 02:58:55"
2850,2025-07-20 21:54:58+00:00,"🟢 **Відбій повітряної тривоги!**

21.07.2025, 00:54:50 ⏱️ 31 хв."
2849,2025-07-20 21:26:48+00:00,"Нічка не обіцяє бути спокійною: у повітрі 3+ тушок, у морі каліброносій, шахеди вже на Житомирщині."
2848,2025-07-20 21:23:06+00:00,"🔴 **Повітряна тривога❗️**
✈️ МіГ-31К[инджал]

21.07.2025, 00:22:55"
2847,2025-07-19 02:27:47+00:00,"🟢 **Відбій повітряної тривоги!**

19.07.2025, 05:27:38 ⏱️ 1 год. 15 хв."
2846,2025-07-19 01:12:38+00:00,"🔴 **Повітряна тривога❗️**
Ракетна небезпека

19.07.2025, 04:12:26"
2845,2025-07-18 23:11:20+00:00,"🟢 **Відбій повітряної тривоги!**

19.07.2025, 02:11:09 ⏱️ 56 хв."
2844,2025-07-18 22:14:25+00:00,"🔴 **Повітряна тривога❗️**
Загроза ударних БпЛА

19.07.2025, 01:14:14"
2843,2025-07-18 21:16:11+00:00,"🟢 **Відбій повітряної тривоги!**

19.07.2025, 00:16:01 ⏱️ 29 хв."
2842,2025-07-18 20:46:31+00:00,"🔴 **Повітряна тривога❗️**
Загроза ударних БпЛА з півночі

18.07.2025, 23:46:28"
2841,2025-07-15 13:20:18+00:00,"🟢 **Відбій повітряної тривоги!**

15.07.2025, 16:20:15 ⏱️ 19 хв."
2840,2025-07-15 13:00:43+00:00,"🔴 **Повітряна тривога❗️**
✈️ МіГ-31К[инджал]

15.07.2025, 16:00:42"
2839,2025-07-15 11:15:28+00:00,"🟢 **Відбій повітряної тривоги!**

15.07.2025, 14:15:22 ⏱️ 16 хв."
2838,2025-07-15 10:59:10+00:00,"🔴 **Повітряна тривога❗️**
✈️ МіГ-31К[инджал]

15.07.2025, 13:59:01"
2837,2025-07-14 11:31:27+00:00,"🟢 **Відбій повітряної тривоги!**

14.07.2025, 14:31:18 ⏱️ 13 хв."
2836,2025-07-14 11:18:05+00:00,"🔴 **Повітряна тривога❗️**
✈️ МіГ-31К[инджал]

14.07.2025, 14:17:56"
2835,2025-07-12 19:03:48+00:00,"🟢 **Відбій повітряної тривоги!**

12.07.2025, 22:03:43 ⏱️ 1 год. 33 хв."
2834,2025-07-12 17:32:10+00:00,"Львів, будьмо уважні!"
2833,2025-07-12 17:29:54+00:00,"🔴 **Повітряна тривога❗️**
Загроза ударних БпЛА

12.07.2025, 20:29:46"
2832,2025-07-12 02:05:50+00:00,"🟢 **Відбій повітряної тривоги!**

12.07.2025, 05:05:44 ⏱️ 2 год. 32 хв."
2831,2025-07-12 01:57:25+00:00,Відшахедилось.
2830,2025-07-12 00:45:28+00:00,"Львів, будьмо уважні!"
2829,2025-07-11 23:33:43+00:00,"🔴 **Повітряна тривога❗️**
Загроза ударних БпЛА

12.07.2025, 02:33:38"
2828,2025-07-10 13:07:57+00:00,"🟢 **Відбій повітряної тривоги!**

10.07.2025, 16:07:47 ⏱️ 46 хв."
2827,2025-07-10 12:21:35+00:00,"🔴 **Повітряна тривога❗️**
Загроза ударних БпЛА
з північно-східного напрямку 

10.07.2025, 15:21:26"
2826,2025-07-10 12:05:48+00:00,"🟢 **Відбій повітряної тривоги!**

10.07.2025, 15:05:32 ⏱️ 2 год. 2 хв."
2825,2025-07-10 10:03:14+00:00,"🔴 **Повітряна тривога❗️**
Загроза ударних БпЛА

10.07.2025, 13:03:03"
2824,2025-07-09 21:46:48+00:00,"🟢 **Відбій повітряної тривоги!**

10.07.2025, 00:46:44 ⏱️ 2 год. 20 хв."
2823,2025-07-09 19:26:44+00:00,"🔴 **Повітряна тривога❗️**
Загроза ударних БпЛА

09.07.2025, 22:26:31"
2822,2025-07-09 02:43:58+00:00,"🟢 **Відбій повітряної тривоги!**

09.07.2025, 05:43:56 ⏱️ 3 год. 48 хв."
2821,2025-07-08 22:55:21+00:00,"🔴 **Повітряна тривога❗️**
Загроза ударних БпЛА

09.07.2025, 01:55:16"
2820,2025-07-08 20:31:18+00:00,"🟢 **Відбій повітряної тривоги!**

08.07.2025, 23:31:03 ⏱️ 39 хв."
2819,2025-07-08 19:51:35+00:00,"🔴 **Повітряна тривога❗️**
✈️ МіГ-31К[инджал]

08.07.2025, 22:51:35"
2818,2025-07-05 19:06:39+00:00,"🟢 **Відбій повітряної тривоги!**

05.07.2025, 22:06:33 ⏱️ 19 хв."
2817,2025-07-05 18:47:11+00:00,"🔴 **Повітряна тривога❗️**
✈️ МіГ-31К[инджал]

05.07.2025, 21:47:08"
2816,2025-07-05 15:17:48+00:00,"🟢 **Відбій повітряної тривоги!**

05.07.2025, 18:17:34 ⏱️ 40 хв."
2815,2025-07-05 14:48:39+00:00,🚀ракета на Житомирщині курсом на Старокостянтинів
2814,2025-07-05 14:37:21+00:00,"🔴 **Повітряна тривога❗️**
Пуск Кинджалу у західному напрямку

05.07.2025, 17:37:14"
2813,2025-07-05 14:36:33+00:00,Зліт ✈️ МіГ-31К[инджал]
2812,2025-07-04 10:22:25+00:00,💙💛 ✈️
2811,2025-07-03 21:58:15+00:00,"🟢 **Відбій повітряної тривоги!**

04.07.2025, 00:58:00 ⏱️ 34 хв."
2810,2025-07-03 21:23:29+00:00,"🔴 **Повітряна тривога❗️**
Зліт ✈️ МіГ-31К[инджал]

04.07.2025, 00:23:14"
2809,2025-06-29 02:06:13+00:00,"🟢 **Відбій повітряної тривоги!**

29.06.2025, 05:06:04 ⏱️ 3 год. 49 хв."
2808,2025-06-28 22:39:01+00:00,Будьмо уважні!
2807,2025-06-28 22:16:34+00:00,"🔴 **Повітряна тривога❗️**
~ 40-50 шахедів го вест

29.06.2025, 01:16:27"
2806,2025-06-28 22:16:14+00:00,Загроза ударних БпЛА 🛵
2805,2025-06-27 01:24:20+00:00,"🟢 **Відбій повітряної тривоги!**

27.06.2025, 04:24:12 ⏱️ 38 хв."
2804,2025-06-27 00:46:23+00:00,"🔴 **Повітряна тривога❗️**
Ракетна небезпека: Калібри

27.06.2025, 03:46:10"
2803,2025-06-26 22:28:48+00:00,"🟢 **Відбій повітряної тривоги!**

27.06.2025, 01:28:38 ⏱️ 28 хв."
2801,2025-06-26 22:00:42+00:00,"🔴 **Повітряна тривога❗️**
Зліт ✈️ МіГ-31К[инджал]

27.06.2025, 01:00:33"
2800,2025-06-21 01:10:22+00:00,"🟢 **Відбій повітряної тривоги!**

21.06.2025, 04:10:10 ⏱️ 51 хв."
2799,2025-06-21 00:19:11+00:00,"🔴 **Повітряна тривога❗️**
Зліт ✈️ МіГ-31К[инджал]

21.06.2025, 03:19:09"
2798,2025-06-18 09:01:42+00:00,"🟢 **Відбій повітряної тривоги!**

18.06.2025, 12:01:33 ⏱️ 19 хв."
2797,2025-06-18 08:42:30+00:00,"🔴 **Повітряна тривога❗️**
Зліт ✈️ МіГ-31К[инджал]

18.06.2025, 11:42:19"
2796,2025-06-17 01:17:56+00:00,"🟢 **Відбій повітряної тривоги!**

17.06.2025, 04:17:54 ⏱️ 2 год. 49 хв."
2795,2025-06-16 22:28:21+00:00,"🔴 **Повітряна тривога❗️**
Зліт ✈️ МіГ-31К[инджал]
+ Калібри з Чорного моря.

17.06.2025, 01:28:19"
2794,2025-06-14 23:40:59+00:00,"🟢 **Відбій повітряної тривоги!**

15.06.2025, 02:40:56 ⏱️ 30 хв."
2793,2025-06-14 23:10:36+00:00,"🔴 **Повітряна тривога❗️**
Зліт ✈️ МіГ-31К[инджал]

15.06.2025, 02:10:34"
2792,2025-06-09 06:32:11+00:00,"🟢 **Відбій повітряної тривоги!**

09.06.2025, 09:32:06 ⏱️ 35 хв."
2791,2025-06-09 05:56:20+00:00,"🔴 **Повітряна тривога❗️**
Пуски кинджал, вектор західний, ймовірно Рівненщина!
Будьмо уважні.

09.06.2025, 08:56:15"
2790,2025-06-09 05:55:06+00:00,Зліт ✈️ МіГ-31К[инджал]
2789,2025-06-09 02:22:38+00:00,"🟢 **Відбій повітряної тривоги!**

09.06.2025, 05:22:28 ⏱️ 2 год. 21 хв."
2788,2025-06-09 00:01:08+00:00,"🔴 **Повітряна тривога❗️**
Зліт ✈️ МіГ-31К[инджал]
+ Загроза ракетного удару

09.06.2025, 03:01:05"
2787,2025-06-08 23:59:01+00:00,Зліт ✈️ МіГ-31К[инджал]
2786,2025-06-08 21:09:37+00:00,"**🔮 Тривожно!
У повітряному просторі України групи ворожих «Шахедів».
Відбувся виліт кількох бортів Ту-95мс з ае «Оленья».

Ймовірна загроза ракетного удару очікується близько 4 години ранку.**"
2785,2025-06-06 02:00:47+00:00,"🟢 **Відбій повітряної тривоги!**
**
**
**Ворог атакував Львівщину бойовими безпілотниками та крилатими ракетами.
Жертв і постраждалих немає. У Дрогобицькому районі пошкоджень зазнав промисловий обʼєкт.**

06.06.2025, 05:00:39 ⏱️ 4 год. 4 хв."
2784,2025-06-05 21:55:51+00:00,"🔴 **Повітряна тривога❗️**
Загроза ракетного удару

06.06.2025, 00:55:41"
2783,2025-06-05 21:54:08+00:00,Загроза ракетного удару
2782,2025-06-03 12:52:57+00:00,"🟢 **Відбій повітряної тривоги!**

03.06.2025, 15:52:56 ⏱️ 23 хв."
2781,2025-06-03 12:29:58+00:00,"🔴 **Повітряна тривога❗️**
Загроза балістики 🤢

03.06.2025, 15:29:54"
2780,2025-06-03 11:53:37+00:00,"🟢 **Відбій повітряної тривоги!**

03.06.2025, 14:53:26 ⏱️ 29 хв."
2779,2025-06-03 11:24:21+00:00,"🔴 **Повітряна тривога❗️**
Зліт ✈️ МіГ-31К[инджал]

03.06.2025, 14:24:20"
2778,2025-06-03 07:23:27+00:00,"🟢 **Відбій повітряної тривоги!**

03.06.2025, 10:23:20 ⏱️ 32 хв."
2777,2025-06-03 06:54:52+00:00,Будьмо уважні!
2776,2025-06-03 06:51:16+00:00,"🔴 **Повітряна тривога❗️**
Зліт ✈️ МіГ-31К[инджал]

03.06.2025, 09:51:15"
2775,2025-05-27 06:40:24+00:00,"🟢 **Відбій повітряної тривоги!**

27.05.2025, 09:40:15 ⏱️ 8 хв."
2774,2025-05-27 06:31:48+00:00,"🔴 **Повітряна тривога❗️**
~~Зліт ✈️ МіГ-31К[инджал]~~

27.05.2025, 09:31:43"
2773,2025-05-26 02:43:41+00:00,"🟢 **Відбій повітряної тривоги!**

26.05.2025, 05:43:37 ⏱️ 1 год. 30 хв."
2772,2025-05-26 01:13:08+00:00,"🔴 **Повітряна тривога❗️**
Загроза ракетних ударів

26.05.2025, 04:13:00"
2771,2025-05-25 01:34:46+00:00,"🟢 **Відбій повітряної тривоги!**

25.05.2025, 04:34:38 ⏱️ 2 год. 21 хв."
2770,2025-05-24 23:13:38+00:00,"🔴 **Повітряна тривога❗️**
Загроза ракетних ударів

25.05.2025, 02:13:31"
2769,2025-05-23 12:55:47+00:00,"🟢 **Відбій повітряної тривоги!**

23.05.2025, 15:55:37 ⏱️ 18 хв."
2768,2025-05-23 12:37:17+00:00,"🔴 **Повітряна тривога❗️**
Зліт ✈️ МіГ-31К[инджал]

23.05.2025, 15:37:17"
2767,2025-05-15 03:07:04+00:00,"🟢 **Відбій повітряної тривоги!**

15.05.2025, 06:07:01 ⏱️ 46 хв."
2766,2025-05-15 02:20:16+00:00,"🔴 **Повітряна тривога❗️**
Загроза ударних БпЛА

15.05.2025, 05:20:06"
2765,2025-05-13 17:09:30+00:00,"🟢 **Відбій повітряної тривоги!**

13.05.2025, 20:09:16 ⏱️ 32 хв."
2764,2025-05-13 16:36:23+00:00,"🔴 **Повітряна тривога❗️**
2x Міг-31К

13.05.2025, 19:36:20"
2763,2025-04-30 08:14:47+00:00,"🟢 **Відбій повітряної тривоги!**

30.04.2025, 11:14:34 ⏱️ 1 год. 0 хв."
2762,2025-04-30 07:14:29+00:00,"🔴 **Повітряна тривога❗️**
Загроза ударних БпЛА

30.04.2025, 10:14:17"
2761,2025-04-30 01:50:23+00:00,"🟢 **Відбій повітряної тривоги!**

30.04.2025, 04:50:16 ⏱️ 1 год. 28 хв."
2760,2025-04-30 00:22:14+00:00,"🔴 **Повітряна тривога❗️**
✈️ МіГ-31К[инджал]


30.04.2025, 03:22:14"
2759,2025-04-24 03:15:33+00:00,"🟢 **Відбій повітряної тривоги!**

24.04.2025, 06:15:23 ⏱️ 5 год. 32 хв."
2758,2025-04-23 21:50:34+00:00,Ніч не буде спокійна. Після 4 ранку очікується загроза ракетного удару ворожої стратегічної авіації Ту-95мс.
2757,2025-04-23 21:42:38+00:00,"🔴 **Повітряна тривога❗️**
Калібри

24.04.2025, 00:42:27"
2756,2025-04-18 11:32:07+00:00,"🟢 **Відбій повітряної тривоги!**

18.04.2025, 14:31:58 ⏱️ 17 хв."
2755,2025-04-18 11:14:54+00:00,"🔴 **Повітряна тривога❗️**
✈️ МіГ-31К[инджал]

18.04.2025, 14:14:50"
2754,2025-04-17 11:03:41+00:00,"🟢 **Відбій повітряної тривоги!**

17.04.2025, 14:03:38 ⏱️ 21 хв."
2753,2025-04-17 10:42:16+00:00,"🔴 **Повітряна тривога❗️**
✈️ МіГ-31К[инджал]

17.04.2025, 13:42:15"
2752,2025-04-17 10:41:54+00:00,Зліт ✈️ МіГ-31К[инджал]
2751,2025-04-09 14:49:29+00:00,"🟢 **Відбій повітряної тривоги!**

09.04.2025, 17:49:19 ⏱️ 22 хв."
2750,2025-04-09 14:27:23+00:00,"🔴 **Повітряна тривога❗️**
✈️ МіГ-31К[инджал]

09.04.2025, 17:27:17"
2749,2025-04-09 14:27:05+00:00,Зліт Міг-31К
2748,2025-04-06 04:03:21+00:00,"🟢 **Відбій повітряної тривоги!**

06.04.2025, 07:03:20 ⏱️ 2 год. 3 хв."
2747,2025-04-06 02:45:47+00:00,"🚀 Ракети з півночі через Чернігівщину, курсом на південь!"
2746,2025-04-06 01:59:53+00:00,"🔴 **Повітряна тривога❗️**
Загроза ракетного удару!
4:58 балістика з брящини на Київ
5:45  Крилаті ракети з Ту-95 ввійшли у повітряний простір країни

06.04.2025, 04:59:43"
2745,2025-04-06 00:39:13+00:00,"🟢 **Відбій повітряної тривоги!**

06.04.2025, 03:39:04 ⏱️ 1 год. 43 хв."
2744,2025-04-05 22:56:03+00:00,"🔴 **Повітряна тривога❗️**
Ракетна небезпека
калібри

06.04.2025, 01:56:00"
2743,2025-04-03 11:24:10+00:00,"🟢 **Відбій повітряної тривоги!**

03.04.2025, 14:24:05 ⏱️ 23 хв."
2742,2025-04-03 11:00:41+00:00,"🔴 **Повітряна тривога❗️**
✈️ МіГ-31К[инджал]

03.04.2025, 14:00:35"
2741,2025-03-14 16:14:05+00:00,"🟢 **Відбій повітряної тривоги!**

14.03.2025, 18:14:02 ⏱️ 18 хв."
2740,2025-03-14 15:55:20+00:00,"🔴 **Повітряна тривога❗️**
✈️ МіГ-31К[инджал]

14.03.2025, 17:55:09"
2739,2025-03-13 10:52:39+00:00,"🟢 **Відбій повітряної тривоги!**

13.03.2025, 12:52:26 ⏱️ 16 хв."
2738,2025-03-13 10:35:52+00:00,"🔴 **Повітряна тривога❗️**
Зліт Міг-31К

13.03.2025, 12:35:45"
2737,2025-03-07 05:28:38+00:00,"🟢 **Відбій повітряної тривоги!**

07.03.2025, 07:28:32 ⏱️ 3 год. 29 хв."
2736,2025-03-07 01:58:44+00:00,"🔴 **Повітряна тривога❗️**
Загроза ракетного удару 

07.03.2025, 03:58:33"
2735,2025-03-06 15:39:52+00:00,"🟢 **Відбій повітряної тривоги!**

06.03.2025, 17:39:41 ⏱️ 18 хв."
2734,2025-03-06 15:21:12+00:00,"🔴 **Повітряна тривога❗️**
✈️ МіГ-31К[инджал]

06.03.2025, 17:21:00"
2733,2025-03-06 15:20:20+00:00,Зліт Міг-31К
2732,2025-03-03 10:08:11+00:00,"🟢 **Відбій повітряної тривоги!**

03.03.2025, 12:08:02 ⏱️ 22 хв."
2731,2025-03-03 09:45:25+00:00,"🔴 **Повітряна тривога❗️**
Зліт Міг-31К

03.03.2025, 11:45:19"
2730,2025-02-25 05:28:41+00:00,"🟢 **Відбій повітряної тривоги!**

25.02.2025, 07:28:34 ⏱️ 1 год. 34 хв."
2729,2025-02-25 03:54:00+00:00,"🔴 **Повітряна тривога❗️**
Загроза ракетного удару 

25.02.2025, 05:53:50"
2728,2025-02-24 09:33:20+00:00,"🟢 **Відбій повітряної тривоги!**

24.02.2025, 11:33:13 ⏱️ 24 хв."
2727,2025-02-24 09:08:59+00:00,"🔴 **Повітряна тривога❗️**
Зліт Міг-31К

24.02.2025, 11:08:46"
2726,2025-02-20 04:39:30+00:00,"🟢 **Відбій повітряної тривоги!**

20.02.2025, 06:39:22 ⏱️ 18 хв."
2725,2025-02-20 04:20:40+00:00,"🔴 **Повітряна тривога❗️**
Загроза ракетного удару 

20.02.2025, 06:20:34"
2724,2025-02-11 04:51:50+00:00,"🟢 **Відбій повітряної тривоги!**

11.02.2025, 06:51:37 ⏱️ 12 хв."
2723,2025-02-11 04:39:31+00:00,"🔴 **Повітряна тривога❗️**


11.02.2025, 06:39:17"
2722,2025-02-06 09:04:10+00:00,"🟢 **Відбій повітряної тривоги!**

06.02.2025, 11:04:06 ⏱️ 31 хв."
2721,2025-02-06 08:33:15+00:00,"🔴 **Повітряна тривога❗️**


06.02.2025, 10:33:06"
2720,2025-02-06 08:32:59+00:00,☄️ Загроза застосування балістичного озброєння по усій території України!
2719,2025-02-01 07:15:23+00:00,"🟢 **Відбій повітряної тривоги!**

01.02.2025, 09:15:10 ⏱️ 2 год. 23 хв."
2718,2025-02-01 04:51:17+00:00,"🔴 **Повітряна тривога❗️**
Загроза ракетного удару.

01.02.2025, 06:51:13"
2717,2025-01-28 09:34:20+00:00,"🟢 **Відбій повітряної тривоги!**

28.01.2025, 11:34:15 ⏱️ 13 хв."
2716,2025-01-28 09:20:33+00:00,"🔴 **Повітряна тривога❗️**
МіГ-31К[инджал]

28.01.2025, 11:20:30"
2715,2025-01-27 04:25:30+00:00,"🟢 **Відбій повітряної тривоги!**

27.01.2025, 06:25:23 ⏱️ 51 хв."
2714,2025-01-27 03:34:00+00:00,"🔴 **Повітряна тривога❗️**
Загроза БпЛА

27.01.2025, 05:33:47"
2713,2025-01-24 04:26:45+00:00,"🟢 **Відбій повітряної тривоги!**

24.01.2025, 06:26:37 ⏱️ 2 год. 2 хв."
2712,2025-01-24 03:47:18+00:00,~~Пара шахедів 5-10хв~~
2711,2025-01-24 02:57:17+00:00,"~~Курс на Львів ‼️ 5-10хв~~

5:05 Поки чисто. Найближчі на Тернопільщині тим е курсом."
2710,2025-01-24 02:24:39+00:00,"🔴 **Повітряна тривога❗️**
БпЛА «шахед»

24.01.2025, 04:24:31"
2709,2025-01-15 06:12:28+00:00,"🟢 **Відбій повітряної тривоги!**

15.01.2025, 08:12:25 ⏱️ 2 год. 0 хв."
2708,2025-01-15 04:11:55+00:00,"🔴 **Повітряна тривога❗️**
Загроза ракетного удару 

15.01.2025, 06:11:49"
2707,2025-01-15 00:48:46+00:00,"🟢 **Відбій повітряної тривоги!**

15.01.2025, 02:48:33 ⏱️ 1 год. 13 хв."
2706,2025-01-14 23:35:03+00:00,"🔴 **Повітряна тривога❗️**
Загроза ударних БпЛА 

15.01.2025, 01:35:02"
2705,2025-01-12 12:24:37+00:00,"🟢 **Відбій повітряної тривоги!**

12.01.2025, 14:24:26 ⏱️ 27 хв."
2704,2025-01-12 11:57:33+00:00,"🔴 **Повітряна тривога❗️**
Загроза балістики 🤢 + ✈️ МіГ-31К[инджал]

12.01.2025, 13:57"
2703,2025-01-08 09:03:09+00:00,"🟢 **Відбій повітряної тривоги!**

08.01.2025, 11:03:04 ⏱️ 27 хв."
2702,2025-01-08 08:35:38+00:00,"🔴 **Повітряна тривога❗️**
✈️ МіГ-31К[инджал]

08.01.2025, 10:35"
2701,2025-01-03 14:58:01+00:00,"🟢 **Відбій повітряної тривоги!**

03.01.2025, 16:57:55 ⏱️ 14 хв."
2700,2025-01-03 14:43:35+00:00,"🔴 **Повітряна тривога❗️**


03.01.2025, 16:43:22"
2699,2025-01-03 14:42:41+00:00,"🟢 **Відбій повітряної тривоги!**

03.01.2025, 16:42:32 ⏱️ 18 хв."
2698,2025-01-03 14:25:45+00:00,Львів в укриття!
2697,2025-01-03 14:24:29+00:00,"🔴 **Повітряна тривога❗️**
Загроза балістики

03.01.2025, 16:24:24"
2696,2025-01-03 12:09:30+00:00,"🟢 **Відбій повітряної тривоги!**

03.01.2025, 14:09:19 ⏱️ 29 хв."
2695,2025-01-03 11:40:25+00:00,"🔴 **Повітряна тривога❗️**


03.01.2025, 13:40:15"
2694,2025-01-03 11:39:14+00:00,✈️ Зліт МіГ-31К[инджал]
2693,2025-01-02 12:50:30+00:00,"🟢 **Відбій повітряної тривоги!**

02.01.2025, 14:50:25 ⏱️ 33 хв."
2692,2025-01-02 12:17:26+00:00,"🔴 **Повітряна тривога❗️**
Загроза балістики 🤢

02.01.2025, 14:17:16"
2691,2024-12-31 07:19:52+00:00,"🟢 **Відбій повітряної тривоги!**

31.12.2024, 09:19:45 ⏱️ 1 год. 22 хв."
2690,2024-12-31 05:57:30+00:00,"🔴 **Повітряна тривога❗️**
Загроза балістики 

31.12.2024, 07:57:25"
2689,2024-12-25 08:20:09+00:00,"🟢 **Відбій повітряної тривоги!**

25.12.2024, 10:19:58 ⏱️ 13 хв."
2688,2024-12-25 08:06:23+00:00,"🔴 **Повітряна тривога❗️**
Ракетна небезпека для західних областей.

25.12.2024, 10:06:13"
2687,2024-12-25 06:20:42+00:00,"🟢 **Відбій повітряної тривоги!**

25.12.2024, 08:20:37 ⏱️ 2 год. 40 хв."
2686,2024-12-25 03:39:57+00:00,"🔴 **Повітряна тривога❗️**
Загроза ракетних ударів

25.12.2024, 05:39:49"
2685,2024-12-25 03:22:47+00:00,"У найближчу годину очікуємо оголошення тривоги. 
Відбулись пуски Калібрів з моря та ймовірно крилатих ракет з Ту-95."
2684,2024-12-23 16:20:35+00:00,"🟢 **Відбій повітряної тривоги!**

23.12.2024, 18:20:26 ⏱️ 21 хв."
2683,2024-12-23 15:59:29+00:00,"🔴 **Повітряна тривога❗️**
Загроза застосування балістичного озброєння по всій території України.
🤢 Капусняк

23.12.2024, 17:59:19"
2682,2024-12-21 09:02:57+00:00,"🟢 **Відбій повітряної тривоги!**

21.12.2024, 11:02:44 ⏱️ 30 хв."
2681,2024-12-21 08:32:31+00:00,"🔴 **Повітряна тривога❗️**
Загроза застосування балістичного озброєння по всій території України!
🤢 капусняк

21.12.2024, 10:32:20"
2680,2024-12-20 10:37:29+00:00,"🟢 **Відбій повітряної тривоги!**

20.12.2024, 12:37:28 ⏱️ 22 хв."
2678,2024-12-20 10:36:51+00:00,Чисто.
2677,2024-12-20 10:35:32+00:00,Будьмо уважні!
2676,2024-12-20 10:16:10+00:00,☄️ Загроза застосування балістичного озброєння по всій території України.
2675,2024-12-20 10:15:30+00:00,"🔴 **Повітряна тривога❗️**
Загроза балістики!!!

20.12.2024, 12:15:18"
2674,2024-12-20 05:41:20+00:00,"🟢 **Відбій повітряної тривоги!**

20.12.2024, 07:41:15 ⏱️ 1 год. 4 хв."
2673,2024-12-20 04:36:57+00:00,"🔴 **Повітряна тривога❗️**
Зліт Міг

20.12.2024, 06:36:54"
2672,2024-12-14 07:55:54+00:00,"🟢 **Відбій повітряної тривоги!**

14.12.2024, 09:55:48 ⏱️ 28 хв."
2671,2024-12-14 07:35:06+00:00,"🔥Бойова робота мобільних вогневих груп 13.12.2024 
114-ї бригади тактичної авіації ПвК «Захід»."
2670,2024-12-14 07:27:35+00:00,"🔴 **Повітряна тривога❗️**
✈️ МіГ-31К[инджал]

14.12.2024, 09:27:23"
2669,2024-12-13 07:57:06+00:00,"🟢 **Відбій повітряної тривоги!**

13.12.2024, 09:57:05 ⏱️ 3 год. 8 хв."
2668,2024-12-13 07:18:48+00:00,На заході тимчасово чисто. Нова хвиля КР заходить у центральні області.
2667,2024-12-13 06:49:51+00:00,"Кинджали на захід. Ймовірно, Стрий."
2666,2024-12-13 06:14:15+00:00,"КР вже у сусідніх областях: Тернопільщина, Франківщина, Рівненщина (!)"
2665,2024-12-13 05:51:38+00:00,"Станом на зараз КР у повітряному просторі центральних областей, курс на Вінниччину. 
Комбінована атака: Х-101 з Тушок + Калібри з моря + МіГ-31К у повітрі."
2664,2024-12-13 04:48:18+00:00,"🔴 **Повітряна тривога❗️**
Загроза ракетних ударів

13.12.2024, 06:48:06"
2663,2024-12-06 12:08:51+00:00,"🟢 **Відбій повітряної тривоги!**

06.12.2024, 14:08:49 ⏱️ 30 хв."
2662,2024-12-06 11:38:26+00:00,"🔴 **Повітряна тривога❗️**
Загроза балістики⚠️

06.12.2024, 13:38"
2661,2024-12-03 09:05:27+00:00,"🟢 **Відбій повітряної тривоги!**

03.12.2024, 11:05:23 ⏱️ 36 хв."
2660,2024-12-03 08:28:45+00:00,"🔴 **Повітряна тривога❗️**
✈️ МіГ-31К[инджал]

03.12.2024, 10:28"
2659,2024-12-03 02:05:54+00:00,"🟢 **Відбій повітряної тривоги!**

03.12.2024, 04:05:43 ⏱️ 54 хв."
2658,2024-12-03 01:11:42+00:00,"🔴 **Повітряна тривога❗️**
Загроза ударних БпЛа

03.12.2024, 03:11:34"
2657,2024-12-03 01:11:42+00:00,Загроза ударних БпЛа
2656,2024-11-28 07:15:36+00:00,"🟢 **Відбій повітряної тривоги!**

28.11.2024, 09:15:35 ⏱️ 3 год. 57 хв."
2655,2024-11-28 04:24:50+00:00,Ракета через Івано-Франківщину рухається в напрямку Стрия
2654,2024-11-28 04:22:12+00:00,"КР у західних областях! Рівне, Луцьк, Тернопіль… будьмо уважні!"
2653,2024-11-28 03:36:02+00:00,Калібри з ЧМ вже на півдні + на підльоті кр Ту-95МС. Тривога буде тривалою.
2652,2024-11-28 03:18:26+00:00,"🔴 **Повітряна тривога❗️**
Загроза ракетного удару!

28.11.2024, 05:18:19"
2651,2024-11-27 11:22:23+00:00,"🟢 **Відбій повітряної тривоги!**

27.11.2024, 13:22:22 ⏱️ 19 хв."
2650,2024-11-27 11:03:13+00:00,"🔴 **Повітряна тривога❗️**
✈️ МіГ-31К[инджал]

27.11.2024, 13:03:06"
2649,2024-11-27 11:03:00+00:00,✈️ МіГ-31К[инджал]
2648,2024-11-26 14:10:20+00:00,"🟢 **Відбій повітряної тривоги!**

26.11.2024, 16:10:18 ⏱️ 26 хв."
2647,2024-11-26 13:44:07+00:00,"🔴 **Повітряна тривога❗️**
Загроза балістики ⚠️

26.11.2024, 15:44:01"
2646,2024-11-26 08:48:07+00:00,"⚡️ ЗБИТО 76 ВОРОЖИХ БПЛА
➖➖➖➖➖➖➖➖➖➖
У ніч на 26 листопада 2024 року (із 19.30 25 листопада) окупанти атакували Україну балістичними ракетами «Іскандер-М» із Воронезької та Курської областей. Під час нічної атаки ворог випустив рекордну кількість ударних БпЛА типу «Shahed» та безпілотників невстановленого типу із напрямків — Орел, Брянськ, Курськ, Приморсько-Ахтарськ – рф.

Радіотехнічними військами Повітряних Сил виявлено та здійснено супровід 192 повітряних цілей:
- 4 балістичні ракети «Іскандер-М»;
- 188 ворожих БпЛА.

До відбиття нападу залучалися авіація, зенітні ракетні підрозділи, засоби РЕБ та мобільні вогневі групи Повітряних Сил та Сил оборони України.

❗️Станом на 09.00 протиповітряною обороною збито 76 ворожих безпілотників у Київській, Черкаській, Кіровоградській, Чернігівській, Сумській, Харківській, Полтавській, Житомирській, Хмельницькій, Вінницькій, Чернівецькій, Тернопільській, Рівненській, Запорізькій, Дніпропетровській, Одеській та Миколаївській областях.

95 БпЛА — локаційно втрачено, імовірно через активну протидію РЕБ Сил оборони, 5 безпілотників полетіли у бік Білорусі.
На жаль, є влучання в об’єкти критичної інфраструктури, також через масовану атаку БпЛА у кількох регіонах пошкоджено приватні та багатоквартирні будинки. Попередньо обійшлось без жертв та постраждалих.
Інформація оновлюється.

✊ Тримаймо небо!
🇺🇦 Разом – до перемоги!"
2645,2024-11-25 23:53:41+00:00,"🟢 **Відбій повітряної тривоги!**

26.11.2024, 01:53:34 ⏱️ 21 хв."
2644,2024-11-25 23:31:52+00:00,"🔴 **Повітряна тривога❗️**
Загроза БпЛА

26.11.2024, 01:31:46"
2643,2024-11-21 13:31:47+00:00,"🟢 **Відбій повітряної тривоги!**

21.11.2024, 15:31:43 ⏱️ 23 хв."
2642,2024-11-21 13:31:11+00:00,Чисто.
2641,2024-11-21 13:07:51+00:00,"🔴 **Повітряна тривога❗️**
Загроза балістики ⚠️

21.11.2024, 15:07:50"
2640,2024-11-21 05:38:41+00:00,"🟢 **Відбій повітряної тривоги!**

21.11.2024, 07:38:35 ⏱️ 2 год. 34 хв."
2639,2024-11-21 03:04:24+00:00,"🔴 **Повітряна тривога❗️**
Ракетна небезпека (Ту+Міг)

21.11.2024, 05:04"
2638,2024-11-18 15:59:47+00:00,"🟢 **Відбій повітряної тривоги!**

18.11.2024, 17:59:45 ⏱️ 22 хв."
2637,2024-11-18 15:37:37+00:00,"🔴 **Повітряна тривога❗️**
✈️ МіГ-31К[инджал]

18.11.2024, 17:37"
2636,2024-11-17 10:22:12+00:00,"⚡️ ЗБИТО 144 ПОВІТРЯНІ ЦІЛІ — 102 РАКЕТИ ТА 42 БПЛА
➖➖➖➖➖➖➖➖➖➖
У ніч на 17 листопада 2024 року (із 20.00 16 листопада) російські окупанти здійснили масований комбінований удар по об’єктах енергетичного сектору України ракетами різних типів повітряного, наземного та морського базування, а також ударними БпЛА типу «Shahed».

Загалом, за попередніми даними, радіотехнічними військами Повітряних Сил ЗС України виявлено та здійснено супровід 210 повітряних цілей противника — 120 ракет та 90 БпЛА.

По типах:
- 1 гіперзвукова корабельна ракета 3М22 “Циркон”;
- 8 аеробалістичних ракет Х-47М2 «Кинджал»;
- 101 крилата ракета Х-101, «Калібр»;
- 1 балістична ракета «Іскандер-М»;
- 4 крилаті/протирадіолокаційні ракети Х-22/Х-31П;
- 5 керованих авіаційних ракет Х-59/Х-69;
- 90 ударних БпЛА/дронів невстановленого типу.
 
❗️ До повітряного нападу противник залучив 7 стратегічних бомбардувальників Ту-160 та 16 Ту-95МС, 2 дальніх бомбардувальника Ту-22М3, 5 винищувачів-бомбардувальників Су-34, 4 винищувача Су-27, 10 винищувачів МіГ-31К, 4 кораблі — носії крилатих ракет.

Протягом ночі по маршруту слідування ракет та дронів працювали усі наявні сили та засоби протиповітряної оборони. Залучалась авіація, зенітні ракетні підрозділи, засоби РЕБ та мобільні вогневі групи Повітряних Сил та Сил оборони України.

💥  За попередніми даними, станом на 12.00 є інформація про збиття 144 повітряних цілей —102 ракет та 42 БпЛА):

- 1 гіперзвукової корабельної ракети 3М22 “Циркон”;
- 7 аеробалістичних ракет Х-47М2 «Кинджал»;
- 85 крилатих ракет Х-101,«Калібр»;
- 4 крилатих/протирадіолокаційних ракет Х-22/Х-31П;
- 5 керованих авіаційних ракет Х-59/69;
- 42 ударних БпЛА/дронів невстановленого типу (із районів Курськ, Орел, Приморсько-Ахтарськ – рф.).

Внаслідок активної протидії Сил оборони 41 ворожий БпЛА локаційно втрачено у різних регіонах України, ще два БпЛА полетіли в бік росії та тимчасово окупованої території.

Протиповітряна оборона працювала майже у всіх регіонах України — у Київській, Черкаській, Кіровоградській, Чернігівській, Сумській, Харківській, Полтавській, Одеській, Миколаївській, Запорізькій, Дніпропетровській, Житомирській, Вінницькій, Хмельницькій, Тернопільській, Івано-Франківській, Рівненській, Волинській та Львівській областях.

✊ Тримаймо небо!
🇺🇦 Разом – до перемоги!"
2635,2024-11-17 07:25:15+00:00,"🟢 **Відбій повітряної тривоги!**

17.11.2024, 09:25:06 ⏱️ 2 год. 47 хв."
2634,2024-11-17 06:05:32+00:00,КР маневрують західними областями. На Львівщині поки чисто.
2633,2024-11-17 04:37:46+00:00,"🔴 **Повітряна тривога❗️**
Ракетна небезпека (Ту95)

17.11.2024, 06:37"
2632,2024-11-17 02:42:31+00:00,"🟢 **Відбій повітряної тривоги!**

17.11.2024, 04:42:31 ⏱️ 1 год. 32 хв."
2631,2024-11-17 01:09:48+00:00,"🔴 **Повітряна тривога❗️**
Загроза БпЛА

17.11.2024, 03:09"
2630,2024-11-13 06:32:35+00:00,"🟢 **Відбій повітряної тривоги!**

13.11.2024, 08:32:34 ⏱️ 1 год. 43 хв."
2629,2024-11-13 06:32:17+00:00,Чисто
2628,2024-11-13 04:49:16+00:00,"🔴 **Повітряна тривога❗️**
Ракетна небезпека Ту95

13.11.2024, 06:49:14"
2627,2024-11-11 05:28:10+00:00,"Ймовірне оголошення тривоги найближчим часом. 

Існує загроза ракетного удару Активність ТУ95 + Міг31К."
2625,2024-11-09 01:58:22+00:00,"🟢 **Відбій повітряної тривоги!**

09.11.2024, 03:58:19 ⏱️ 59 хв."
2624,2024-11-09 00:58:45+00:00,"🔴 **Повітряна тривога❗️**
Загроза ударних БпЛА

09.11.2024, 02:58"
2623,2024-11-06 12:33:26+00:00,"🟢 **Відбій повітряної тривоги!**

06.11.2024, 14:33:22 ⏱️ 24 хв."
2622,2024-11-06 12:09:21+00:00,"🔴 **Повітряна тривога❗️**
✈️ МіГ-31К[инджал]

06.11.2024, 14:09"
2621,2024-10-28 03:21:41+00:00,"🟢 **Відбій повітряної тривоги!**

28.10.2024, 05:21:33 ⏱️ 50 хв."
2620,2024-10-28 02:31:01+00:00,"🔴 **Повітряна тривога❗️**
Загроза ударних БпЛА

28.10.2024, 04:30"
2619,2024-10-25 08:56:14+00:00,"🟢 **Відбій повітряної тривоги!**

25.10.2024, 11:56:02 ⏱️ 26 хв."
2618,2024-10-25 08:29:54+00:00,"🔴 **Повітряна тривога❗️**
✈️ МіГ-31К[инджал]

25.10.2024, 11:29"
2617,2024-10-25 08:29:08+00:00,✈️ МіГ-31К[инджал]
2616,2024-10-25 01:13:29+00:00,"🟢 **Відбій повітряної тривоги!**

25.10.2024, 04:13:14 ⏱️ 1 год. 47 хв."
2615,2024-10-24 23:25:36+00:00,"🔴 **Повітряна тривога❗️**
Загроза ударних БпЛА

25.10.2024, 02:25"
2614,2024-10-24 23:24:47+00:00,Загроза ударних БпЛА
2613,2024-10-21 09:50:24+00:00,"🟢 **Відбій повітряної тривоги!**

21.10.2024, 12:50:19 ⏱️ 32 хв."
2612,2024-10-21 09:17:49+00:00,"🔴 **Повітряна тривога❗️**
✈️ МіГ-31К[инджал]

21.10.2024, 12:17"
2611,2024-10-21 09:17:43+00:00,✈️ МіГ-31К[инджал]
2610,2024-10-19 22:22:49+00:00,"🟢 **Відбій повітряної тривоги!**

20.10.2024, 01:22:47 ⏱️ 58 хв."
2609,2024-10-19 21:27:01+00:00,🐟🛵🛵 кілька мопедів через Тернопільщину на Львівщину.
2608,2024-10-19 21:24:46+00:00,"🔴 **Повітряна тривога❗️**
Загроза ударних БпЛА

20.10.2024, 00:24"
2607,2024-10-15 08:30:39+00:00,"🟢 **Відбій повітряної тривоги!**

15.10.2024, 11:30:31 ⏱️ 31 хв."
2606,2024-10-15 07:59:19+00:00,"🔴 **Повітряна тривога❗️**


15.10.2024, 10:59:15"
2605,2024-10-15 07:59:01+00:00,✈️ МіГ-31К[инджал]
2604,2024-10-11 20:56:26+00:00,"🟢 **Відбій повітряної тривоги!**

11.10.2024, 23:56:25 ⏱️ 35 хв."
2603,2024-10-11 20:21:21+00:00,"🔴 **Повітряна тривога❗️**


11.10.2024, 23:21:21"
2602,2024-10-11 20:21:10+00:00,✈️ МіГ-31К
2601,2024-10-07 06:00:41+00:00,"🟢 **Відбій повітряної тривоги!**

07.10.2024, 09:00:31 ⏱️ 31 хв."
2600,2024-10-07 05:28:48+00:00,"🔴 **Повітряна тривога❗️**
✈️ МіГ-31К
2х Кинджали у напрямку Хмельниччини

07.10.2024, 08:28"
2599,2024-09-27 14:37:01+00:00,"🟢 **Відбій повітряної тривоги!**

27.09.2024, 17:37:00 ⏱️ 39 хв."
2597,2024-09-27 13:58:43+00:00,Зафіксовано пуски Кинджалів. 2х борта.
2596,2024-09-27 13:57:19+00:00,"🔴 **Повітряна тривога❗️**
✈️ МіГ-31К[инджал]

27.09.2024, 16:57"
2595,2024-09-26 09:12:09+00:00,"🟢 **Відбій повітряної тривоги!**

26.09.2024, 12:12:01 ⏱️ 35 хв."
2594,2024-09-26 08:36:43+00:00,"🔴 **Повітряна тривога❗️**
✈️ МіГ-31К[инджал]

26.09.2024, 11:36:34"
2593,2024-09-26 08:17:39+00:00,"🟢 **Відбій повітряної тривоги!**

26.09.2024, 11:17:34 ⏱️ 28 хв."
2592,2024-09-26 07:54:40+00:00,"UPD: 11:02 Львівщина чисто.

10:54 Пуск Кинджалів курс на захід !
10:56 Ще два кинджали на Хмельниччину

Звуки вибухів у областях, якими проходить траєкторія польоту ""Кинджалів"", ймовірно, є наслідком акустичного ефекту при подоланні ракетою звукового бар'єра. На фінальному етапі кинджал летить майже з гіперзвуковою швидкістю, тому вздовж його маршруту — зазвичай Чернігівської, Київської, Житомирської, Вінницької та Хмельницької областей чутно гучні звуки. Можливі також додаткові звуки від спроб перехоплення."
2591,2024-09-26 07:48:38+00:00,"🔴 **Повітряна тривога❗️**
✈️ МіГ-31К[инджал]

26.09.2024, 10:48:38"
2590,2024-09-26 07:34:20+00:00,"🟢 **Відбій повітряної тривоги!**

26.09.2024, 10:34:17 ⏱️ 34 хв."
2588,2024-09-26 07:02:19+00:00,"Вектор західний, ймовірно Хмельниччина"
2587,2024-09-26 06:59:48+00:00,"🔴 **Повітряна тривога❗️**
Пуск Кинджалу

26.09.2024, 09:59:47"
2586,2024-09-20 18:52:47+00:00,"🟢 **Відбій повітряної тривоги!**

20.09.2024, 21:52:40 ⏱️ 33 хв."
2585,2024-09-20 18:19:19+00:00,"🔴 **Повітряна тривога❗️**
✈️ МіГ-31К[инджал]

20.09.2024, 21:19:12"
2584,2024-09-20 01:31:53+00:00,"🟢 **Відбій повітряної тривоги!**

20.09.2024, 04:31:52 ⏱️ 35 хв."
2583,2024-09-20 00:56:37+00:00,"🔴 **Повітряна тривога❗️**
Загроза ударних БпЛА

20.09.2024, 03:56:27"
2582,2024-09-17 09:57:59+00:00,"🟢 **Відбій повітряної тривоги!**

17.09.2024, 12:57:58 ⏱️ 56 хв."
2581,2024-09-17 09:01:11+00:00,"🔴 **Повітряна тривога❗️**
Будьмо уважні 🛸🛸
В області зафіксовано БпЛА невстановленого типу.

17.09.2024, 12:01"
2580,2024-09-07 00:26:10+00:00,"🟢 **Відбій повітряної тривоги!**

07.09.2024, 03:26:06 ⏱️ 32 хв."
2579,2024-09-06 23:53:14+00:00,"🔴 **Повітряна тривога❗️**
Загроза ударних БпЛА

07.09.2024, 02:53:11"
2578,2024-09-06 00:25:10+00:00,"🟢 **Відбій повітряної тривоги!**

06.09.2024, 03:25:05 ⏱️ 41 хв."
2577,2024-09-05 23:44:02+00:00,"🔴 **Повітряна тривога❗️**


06.09.2024, 02:43:52"
2576,2024-09-05 23:05:24+00:00,"🟢 **Відбій повітряної тривоги!**

06.09.2024, 02:05:16 ⏱️ 54 хв."
2575,2024-09-05 22:10:33+00:00,"🔴 **Повітряна тривога❗️**
Загроза ударних БпЛА

06.09.2024, 01:10:29"
2574,2024-09-05 09:48:04+00:00,"🟢 **Відбій повітряної тривоги!**

05.09.2024, 12:47:57 ⏱️ 31 хв."
2573,2024-09-05 09:16:33+00:00,"🔴 **Повітряна тривога❗️**
✈️ МіГ-31К[инджал]

05.09.2024, 12:16"
2572,2024-09-04 04:38:08+00:00,"🟢 **Відбій повітряної тривоги!**

04.09.2024, 07:38:00 ⏱️ 3 год. 40 хв."
2571,2024-09-04 02:57:08+00:00,"**Так, дуже гучно. Зберігаємо інформаційну тишу.**"
2570,2024-09-04 00:57:53+00:00,"🔴 **Повітряна тривога❗️**
Загроза ударних БпЛА

05:40 Ракетна небезпека

05:45 Кинджал на Львів


04.09.2024, 03:57"
2569,2024-09-04 00:57:43+00:00,Загроза ударних БпЛА
2568,2024-09-02 03:12:49+00:00,"🟢 **Відбій повітряної тривоги!**

02.09.2024, 06:12:45 ⏱️ 1 год. 16 хв."
2567,2024-09-02 01:56:36+00:00,"🔴 **Повітряна тривога❗️**
Загроза ракетних ударів страт авіа ТУ95

02.09.2024, 04:56:34"
2566,2024-08-27 03:56:41+00:00,"🟢 **Відбій повітряної тривоги!**

27.08.2024, 06:56:40 ⏱️ 1 год. 51 хв."
2565,2024-08-27 02:04:52+00:00,"🔴 **Повітряна тривога❗️**
Загроза ракетних ударів

27.08.2024, 05:04"
2564,2024-08-27 01:08:57+00:00,"🟢 **Відбій повітряної тривоги!**

27.08.2024, 04:08:51 ⏱️ 51 хв."
2563,2024-08-27 01:08:53+00:00,"⚠ Увага!
✈ Зафіксовано зліт кількох Ту-95мс з аеродрому Енгельс.
🕓 Орієнтовний час виходу на пускові рубежі – 4.30.
👀 Слідкуйте за нашими повідомленнями та не ігноруйте сигнали повітряної тривоги."
2562,2024-08-27 00:26:01+00:00,2x Кинджали припинили спостерігатися біля Шептицького / Червонограду на Львівщині.
2561,2024-08-27 00:17:51+00:00,"🔴 **Повітряна тривога❗️**
✈️ МіГ-31К[инджал]

27.08.2024, 03:17"
2560,2024-08-26 08:12:06+00:00,"🟢 **Відбій повітряної тривоги!**

26.08.2024, 11:11:58 ⏱️ 5 год. 1 хв."
2559,2024-08-26 06:49:57+00:00,"Зважаючи, що цілями сьогоднішньої масованої атаки рф були здебільшого об'єкти енергетичної інфраструктури, зокрема на Львівщині, можливі перебої з електропостачанням у Львові та області.  Традиційно рекомендуємо подбати про зарядні для смартфонів, запаси питної та технічної води."
2558,2024-08-26 06:46:04+00:00,"КР чисто, шахеди ще літають сусідніми областями. Тривога триває!"
2557,2024-08-26 06:28:14+00:00,Стрий!
2556,2024-08-26 06:09:06+00:00,Кинджал на Стрийщину!
2555,2024-08-26 06:06:34+00:00,"Стрийщина особливо уважно, основний вектор руху у вашу сторону"
2554,2024-08-26 06:01:30+00:00,"КР на Львівщині, перебувайте в укриттях!"
2553,2024-08-26 05:55:53+00:00,Ймовірність КР на Львів
2552,2024-08-26 05:45:37+00:00,"Група крилатих ракет продовжують рухатися у сусідні західні області (Тернопільщина, Франківщина, Рівенщина. 
Перша КР на Львівщині , курсом на Стрий / Миколаїв."
2551,2024-08-26 03:11:01+00:00,"🔴 **Повітряна тривога❗️**
Ракетна небезпека 

26.08.2024, 06:10:51"
2550,2024-08-19 23:59:32+00:00,"🟢 **Відбій повітряної тривоги!**

20.08.2024, 02:59:23 ⏱️ 50 хв."
2549,2024-08-19 23:09:19+00:00,"🔴 **Повітряна тривога❗️**


20.08.2024, 02:09:18"
2548,2024-08-17 19:53:45+00:00,"⚠️ зліт бортів Ту-95 з аеродрому ""Оленья"". ~~Тривогу очікуємо після 3:00 ночі.~~"
2547,2024-08-13 04:47:39+00:00,"🟢 **Відбій повітряної тривоги!**

13.08.2024, 07:47:33 ⏱️ 26 хв."
2546,2024-08-13 04:21:26+00:00,"🔴 **Повітряна тривога❗️**
✈️ МіГ-31К[инджал]

13.08.2024, 07:21"
2545,2024-08-08 04:02:50+00:00,"🟢 **Відбій повітряної тривоги!**

08.08.2024, 07:02:47 ⏱️ 40 хв."
2544,2024-08-08 03:22:11+00:00,"🔴 **Повітряна тривога❗️**


08.08.2024, 06:21:56"
2543,2024-08-07 00:10:44+00:00,"🟢 **Відбій повітряної тривоги!**

07.08.2024, 03:10:35 ⏱️ 32 хв."
2542,2024-08-06 23:38:24+00:00,"🔴 **Повітряна тривога❗️**
БпЛА

07.08.2024, 02:38:21"
2541,2024-08-05 15:28:40+00:00,"🟢 **Відбій повітряної тривоги!**

05.08.2024, 18:28:33 ⏱️ 14 хв."
2540,2024-08-05 15:13:59+00:00,"🔴 **Повітряна тривога❗️**
✈️ МіГ-31К[инджал]

05.08.2024, 18:13"
2539,2024-08-02 08:14:06+00:00,"🟢 **Відбій повітряної тривоги!**

02.08.2024, 11:13:52 ⏱️ 26 хв."
2538,2024-08-02 07:47:39+00:00,"🔴 **Повітряна тривога❗️**
✈️ МіГ-31К[инджал]

02.08.2024, 10:47"
2537,2024-08-02 07:47:14+00:00,✈️ МіГ-31К[инджал]
2536,2024-07-31 09:41:24+00:00,"🟢 **Відбій повітряної тривоги!**

31.07.2024, 12:41:21 ⏱️ 18 хв."
2535,2024-07-31 09:26:36+00:00,"💥 Бойова робота по ворожих «шахедах» уночі 31 липня 2024 року на південному напрямку!
Дякую за влучність!
➖➖➖➖➖➖➖➖➖➖
🦅 Командувач Повітряних Сил генерал-лейтенант Микола Олещук"
2534,2024-07-31 09:26:16+00:00,"Відео збиття ""шахеда"" на східному напрямку вранці 31 липня 2024 року.
❗️Пам’ятайте, що навіть після ураження ворожі ракети та ударні БпЛА становлять серйозну загрозу!
➖➖➖➖➖➖➖➖➖➖
🦅 Командувач Повітряних Сил генерал-лейтенант Микола Олещук"
2533,2024-07-31 09:26:16+00:00,Трохи краси у стрічку новин.
2532,2024-07-31 09:23:31+00:00,"🔴 **Повітряна тривога❗️**
✈️ МіГ-31К[инджал] ае Саваслейка

31.07.2024, 12:23:"
2531,2024-07-31 09:23:12+00:00,✈️ МіГ-31К
2529,2024-07-31 00:26:41+00:00,"🟢 **Відбій повітряної тривоги!**

31.07.2024, 03:26:27 ⏱️ 47 хв."
2528,2024-07-30 23:38:56+00:00,"🔴 **Повітряна тривога❗️**
✈️ МіГ-31К[инджал]

31.07.2024, 02:38"
2527,2024-07-30 17:24:15+00:00,"🟢 **Відбій повітряної тривоги!**

30.07.2024, 20:24:12 ⏱️ 18 хв."
2526,2024-07-30 17:06:23+00:00,"🔴 **Повітряна тривога❗️**
✈️ МіГ-31К

30.07.2024, 20:06"
2525,2024-07-30 17:05:10+00:00,✈️ МіГ-31К
2524,2024-07-25 21:29:00+00:00,"🟢 **Відбій повітряної тривоги!**

26.07.2024, 00:28:55 ⏱️ 17 хв."
2523,2024-07-25 21:11:22+00:00,"🔴 **Повітряна тривога❗️**
✈️ МіГ-31К

26.07.2024, 00:11"
2522,2024-07-25 21:09:25+00:00,✈️ МіГ-31К
2521,2024-07-25 20:04:02+00:00,Наразі все спокійно. Усі Ту-95 здійснюють посадку! Добраніч!
2520,2024-07-25 19:19:03+00:00,"🔮 Нічка ймовірно буде тривожна. Ту-шки у повітрі.
6+ бортів Ту-95 прямують на Енгельс."
2519,2024-07-24 10:11:12+00:00,"🟢 **Відбій повітряної тривоги!**

24.07.2024, 13:11:00 ⏱️ 39 хв."
2518,2024-07-24 09:32:01+00:00,"🔴 **Повітряна тривога❗️**
✈️ МіГ-31К

24.07.2024, 12:31"
2517,2024-07-22 21:22:06+00:00,"🟢 **Відбій повітряної тривоги!**

23.07.2024, 00:21:56 ⏱️ 26 хв."
2516,2024-07-22 20:55:54+00:00,"🔴 **Повітряна тривога❗️**
✈️ МіГ-31К

22.07.2024, 23:55"
2515,2024-07-22 20:55:50+00:00,✈️ МіГ-31К
2514,2024-07-20 18:15:27+00:00,"🔮 Тривожно. 
Зафіксована активність стратегічної авіації ворога. 
Сьогодні вночі або завтра висока ймовірність рекетної атаки."
2513,2024-07-17 20:27:35+00:00,"🟢 **Відбій повітряної тривоги!**

17.07.2024, 23:27:33 ⏱️ 18 хв."
2512,2024-07-17 20:09:13+00:00,"🔴 **Повітряна тривога❗️**
✈️ МіГ-31К

17.07.2024, 23:09"
2511,2024-07-17 18:51:21+00:00,"🟢 **Відбій повітряної тривоги!**

17.07.2024, 21:51:07 ⏱️ 21 хв."
2510,2024-07-17 18:29:19+00:00,"🔴 **Повітряна тривога❗️**
✈️ МіГ-31К

17.07.2024, 21:29"
2509,2024-07-15 05:41:58+00:00,"🟢 **Відбій повітряної тривоги!**

15.07.2024, 08:41:45 ⏱️ 24 хв."
2508,2024-07-15 05:17:15+00:00,"🔴 **Повітряна тривога❗️**
✈️ МіГ-31К

15.07.2024, 08:17"
2507,2024-07-13 08:57:53+00:00,"🟢 **Відбій повітряної тривоги!**

13.07.2024, 11:57:43 ⏱️ 39 хв."
2506,2024-07-13 08:18:42+00:00,"🔴 **Повітряна тривога❗️**
✈️ МіГ-31К

13.07.2024, 11:18"
2505,2024-07-13 08:18:26+00:00,"⚠Увага!
Ракетна небезпека по всій території України! Зліт МіГ-31К з аеродрому Саваслейка."
2504,2024-07-12 18:43:57+00:00,"🟢 **Відбій повітряної тривоги!**

12.07.2024, 21:43:51 ⏱️ 19 хв."
2503,2024-07-12 18:24:36+00:00,"🔴 **Повітряна тривога❗️**
✈️ МіГ-31К

12.07.2024, 21:24"
2502,2024-07-12 18:23:47+00:00,✈️ МіГ-31К
2501,2024-07-11 20:14:37+00:00,"🟢 **Відбій повітряної тривоги!**

11.07.2024, 23:14:31 ⏱️ 25 хв."
2500,2024-07-11 19:49:38+00:00,"🔴 **Повітряна тривога❗️**
✈️ МіГ-31К

11.07.2024, 22:49"
2499,2024-07-11 18:30:03+00:00,"🟢 **Відбій повітряної тривоги!**

11.07.2024, 21:29:56 ⏱️ 44 хв."
2498,2024-07-11 18:03:05+00:00,Старкон на Хмельниччині
2497,2024-07-11 17:45:14+00:00,"🔴 **Повітряна тривога❗️**
**Загроза ракетного удару**
КР через **Київщину** на **Житомирщину → Вінниччину** 

11.07.2024, 20:45"
2496,2024-07-11 14:43:46+00:00,"🟢 **Відбій повітряної тривоги!**

11.07.2024, 17:43:36 ⏱️ 14 хв."
2495,2024-07-11 14:29:19+00:00,"🔴 **Повітряна тривога❗️**
✈️ МіГ-31К

11.07.2024, 17:29"
2494,2024-07-11 14:28:52+00:00,✈️ МіГ-31К
2493,2024-07-11 13:00:11+00:00,"🟢 **Відбій повітряної тривоги!**

11.07.2024, 15:59:58 ⏱️ 28 хв."
2492,2024-07-11 12:31:31+00:00,"🔴 **Повітряна тривога❗️**
✈️ МіГ-31К

11.07.2024, 15:31"
2491,2024-07-10 23:55:03+00:00,"🟢 **Відбій повітряної тривоги!**

11.07.2024, 02:54:55 ⏱️ 1 год. 53 хв."
2490,2024-07-10 22:56:39+00:00,
2489,2024-07-10 22:01:26+00:00,"🔴 **Повітряна тривога❗️**
Шахеди ~ 30 хв

11.07.2024, 01:01:14"
2488,2024-07-10 18:21:28+00:00,"🟢 **Відбій повітряної тривоги!**

10.07.2024, 21:21:17 ⏱️ 25 хв."
2487,2024-07-10 17:55:31+00:00,"🔴 **Повітряна тривога❗️**
Міг-31К

10.07.2024, 20:55:28"
2486,2024-07-09 15:07:10+00:00,У західних областях поки чисто.
2485,2024-07-08 08:35:08+00:00,"🟢 **Відбій повітряної тривоги!**

08.07.2024, 11:34:55 ⏱️ 1 год. 39 хв."
2484,2024-07-08 07:54:04+00:00,"Наразі у нас чисто.

ps: Ракетна небезпека триває до оголошення сигналу відбою."
2483,2024-07-08 07:18:52+00:00,КР Х-101 тримають напрям на західні області →  Рівненщина
2482,2024-07-08 06:59:26+00:00,"Щодо Ту-шок: крилаті ракети Х-101  зайшли через Чернігівщину у південно-західному напрямку → Київщина.

UPD: 10:10
+ дві групи КР Калібр у центральних областях.
+ нова група КР Х-101 на Чернігівщині.
+ вже 2 борти МіГ-31К (Кинджал)"
2481,2024-07-08 06:54:59+00:00,"🔴 **Повітряна тривога❗️**
✈️ МіГ-31К

08.07.2024, 09:54"
2480,2024-07-08 04:42:30+00:00,"🟢 **Відбій повітряної тривоги!**

08.07.2024, 07:42:28 ⏱️ 23 хв."
2479,2024-07-08 04:38:31+00:00,✈️ Зафіксовано зліт 5 бортів Ту-95 з ае Оленья. Ближче 12:00 буде зрозуміло чи бойовий виліт.
2478,2024-07-08 04:18:45+00:00,"🔴 **Повітряна тривога❗️**
✈️ МіГ-31К

08.07.2024, 07:18"
2477,2024-07-08 00:49:07+00:00,"🟢 **Відбій повітряної тривоги!**

08.07.2024, 03:49:01 ⏱️ 1 год. 13 хв."
2476,2024-07-07 23:36:09+00:00,"🔴 **Повітряна тривога❗️**
Загроза ракетного удару!
Перша група крилатих ракет заходять через Чернігівщину, друга — через Сумщину. Напрямок південно-західний → Київ.

Для Львівщини КР Х-101 становитимуть небезпеку не раніше 3:00.

08.07.2024, 02:35"
2475,2024-07-07 19:52:57+00:00,"⚠️ Зафіксовано зліт 4 бортів Ту-95 (ае Оленья).
Орієнтовний час оголошення ракетної небезпеки – після 3 ночі."
2474,2024-07-06 04:47:55+00:00,"🟢 **Відбій повітряної тривоги!**

06.07.2024, 07:47:54 ⏱️ 25 хв."
2473,2024-07-06 04:21:57+00:00,"🔴 **Повітряна тривога❗️**
✈️ МіГ-31К

06.07.2024, 07:21"
2472,2024-07-04 21:10:46+00:00,"🟢 **Відбій повітряної тривоги!**

05.07.2024, 00:10:31 ⏱️ 27 хв."
2471,2024-07-04 20:43:05+00:00,"🔴 **Повітряна тривога❗️**


04.07.2024, 23:43:01"
2470,2024-07-02 14:08:12+00:00,"🟢 **Відбій повітряної тривоги!**

02.07.2024, 17:08:06 ⏱️ 37 хв."
2469,2024-07-02 13:30:29+00:00,"🔴 **Повітряна тривога❗️**
✈️ МіГ-31К

02.07.2024, 16:30"
2468,2024-07-01 20:30:02+00:00,"🟢 **Відбій повітряної тривоги!**

01.07.2024, 23:29:57 ⏱️ 20 хв."
2467,2024-07-01 20:09:43+00:00,"🔴 **Повітряна тривога❗️**
✈️ Зліт МіГ-31К

01.07.2024, 23:09:39"
2466,2024-07-01 14:18:47+00:00,"🟢 **Відбій повітряної тривоги!**

01.07.2024, 17:18:38 ⏱️ 50 хв."
2465,2024-07-01 13:28:35+00:00,"🔴 **Повітряна тривога❗️**
✈️ Зліт МіГ-31К

01.07.2024, 16:28"
2463,2024-06-29 07:32:09+00:00,"🟢 **Відбій повітряної тривоги!**

29.06.2024, 10:31:56 ⏱️ 35 хв."
2462,2024-06-29 06:56:53+00:00,"🔴 **Повітряна тривога❗️**
✈️ Зліт МіГ-31К

29.06.2024, 09:56"
2461,2024-06-27 00:45:29+00:00,"🟢 **Відбій повітряної тривоги!**

27.06.2024, 03:45:20 ⏱️ 1 год. 30 хв."
2460,2024-06-26 23:14:53+00:00,"🔴 **Повітряна тривога❗️**
Калібри та Шахеди

27.06.2024, 02:14:42"
2459,2024-06-25 15:08:46+00:00,"🟢 **Відбій повітряної тривоги!**

25.06.2024, 18:08:37 ⏱️ 46 хв."
2458,2024-06-25 14:22:40+00:00,"🔴 **Повітряна тривога❗️**


25.06.2024, 17:22:27"
2457,2024-06-24 19:34:42+00:00,"🟢 **Відбій повітряної тривоги!**

24.06.2024, 22:34:37 ⏱️ 15 хв."
2456,2024-06-24 19:19:15+00:00,"🔴 **Повітряна тривога❗️**
Зліт МіГ-31К ае Саваслейка

24.06.2024, 22:19:09"
2455,2024-06-24 19:07:32+00:00,"🟢 **Відбій повітряної тривоги!**

24.06.2024, 22:07:28 ⏱️ 21 хв."
2454,2024-06-24 18:45:42+00:00,"🔴 **Повітряна тривога❗️**
Зліт МіГ-31К ае Саваслейка

24.06.2024, 21:45:41"
2453,2024-06-24 17:53:26+00:00,"🟢 **Відбій повітряної тривоги!**

24.06.2024, 20:53:18 ⏱️ 38 хв."
2452,2024-06-24 17:14:56+00:00,"🔴 **Повітряна тривога❗️**
✈️ Зліт МіГ-31К

24.06.2024, 20:14"
2451,2024-06-23 02:42:11+00:00,"🟢 **Відбій повітряної тривоги!**

23.06.2024, 05:42:04 ⏱️ 22 хв."
2450,2024-06-23 02:19:57+00:00,"🔴 **Повітряна тривога❗️**
Калібри. Загроза ракетних ударів

23.06.2024, 05:19:47"
2449,2024-06-22 02:04:20+00:00,"🟢 **Відбій повітряної тривоги!**

22.06.2024, 05:04:09 ⏱️ 2 год. 8 хв."
2448,2024-06-22 01:27:18+00:00,"Стрийщина, будьмо уважні. 
КР у сусідніх областях."
2447,2024-06-22 00:38:34+00:00,"Виглядає на комбіновану атаку на західні області. 
Група шахедів  у західних областях. 
Крилаті ракети із Ту-шок тримають курс на захід. 
З моря були пуски Калібрів.
Очікуємо ще зльоти МіГів."
2446,2024-06-21 23:56:11+00:00,"🔴 **Повітряна тривога❗️**
Загроза ракетного удару.

22.06.2024, 02:55:57"
2445,2024-06-21 23:25:00+00:00,"Попередньо здійснено пуски ракет Х-101/55 з Ту-95 районі Енгельса.
Оголошення повітряних тривог очікуємо о 3:00 – 3:30."
2444,2024-06-21 21:04:57+00:00,"🟢 **Відбій повітряної тривоги!**

22.06.2024, 00:04:51 ⏱️ 25 хв."
2443,2024-06-21 20:39:39+00:00,"🔴 **Повітряна тривога❗️**
✈️ Зліт МіГ-31К

21.06.2024, 23:39:32"
2442,2024-06-21 20:38:43+00:00,✈️ Зліт МіГ-31К
2441,2024-06-21 20:22:43+00:00,"🔮 Тривожно.  Виліт стратавіа Ту-95. 
Крилаті ракети становитимуть загрозу не раніше 03:00 ночі."
2440,2024-06-21 17:36:22+00:00,"🟢 **Відбій повітряної тривоги!**

21.06.2024, 20:36:11 ⏱️ 16 хв."
2439,2024-06-21 17:19:30+00:00,"🔴 **Повітряна тривога❗️**


21.06.2024, 20:19:19"
2438,2024-06-21 17:18:28+00:00,✈️ Зліт МіГ-31К
2437,2024-06-21 11:25:13+00:00,"🟢 **Відбій повітряної тривоги!**

21.06.2024, 14:24:59 ⏱️ 25 хв."
2436,2024-06-21 10:59:12+00:00,"🔴 **Повітряна тривога❗️**
✈️ Зліт МіГ-31К

21.06.2024, 13:59"
2435,2024-06-20 11:21:00+00:00,"🟢 **Відбій повітряної тривоги!**

20.06.2024, 14:20:56 ⏱️ 31 хв."
2434,2024-06-20 10:49:33+00:00,"🔴 **Повітряна тривога❗️**
✈️ Зліт МіГ-31К

20.06.2024, 13:49:22"
2433,2024-06-20 06:02:46+00:00,"Цієї ночі, пролетівши 4 бортами стратегічної авіації Ту-95 МС понад 1800 кілометрів від Мурманської до Саратовської області (район Каспію), ворогу вдалось здійснити пуски лише чотирьох (!) ракет, які досягли повітряного простору України. 

Усі 4 крилаті ракети Х-101/Х-555 були успішно ліквідовані Повітряними Силами. Загроза для західних областей не справдилась."
2432,2024-06-19 19:30:35+00:00,"⚠Увага!
✈Зафіксовано активність 4-х бортів Ту-95МС з аеродрому ""Оленья"" (Мурманська область), що здійснюють політ у південно-східному напрямку.

У разі ракетної загрози та пусків крилатих ракет повідомимо додатково. Не ігноруйте сигнали повітряної тривоги!"
2431,2024-06-19 19:27:18+00:00,"🔮 Тривожно. Минулі дні Ту-95 тренувались, сьогодні очікуємо бойовий виліт. Тривога не раніше 3:30 ночі."
2430,2024-06-19 14:52:11+00:00,"🟢 **Відбій повітряної тривоги!**

19.06.2024, 17:52:06 ⏱️ 35 хв."
2429,2024-06-19 14:16:49+00:00,"🔴 **Повітряна тривога❗️**


19.06.2024, 17:16:39"
2428,2024-06-19 14:14:40+00:00,✈️ Зліт МіГ-31К
2427,2024-06-19 02:24:49+00:00,"🟢 **Відбій повітряної тривоги!**

19.06.2024, 05:24:47 ⏱️ 57 хв."
2426,2024-06-19 01:29:30+00:00,"Мопед з Тернопільщини, крайній."
2425,2024-06-19 01:27:52+00:00,"🔴 **Повітряна тривога❗️**
Загроза ударних БпЛА

19.06.2024, 04:27"
2424,2024-06-19 01:18:53+00:00,"Влучання в Малехові, Львівська громада. 
Відомо про одного пораненого чоловіка-охоронця, 70 років.  Стан середньої важкості. 
Його госпіталізувала швидка."
2423,2024-06-19 00:41:41+00:00,Штири мопеди до Львова летіли – не долетіли
2422,2024-06-19 00:35:39+00:00,"🟢 **Відбій повітряної тривоги!**

19.06.2024, 03:35:39 ⏱️ 1 год. 2 хв."
2421,2024-06-18 23:32:44+00:00,"🔴 **Повітряна тривога❗️**
Загроза ударних БпЛА

19.06.2024, 02:32:44"
2420,2024-06-15 06:38:50+00:00,"🟢 **Відбій повітряної тривоги!**

15.06.2024, 09:38:49 ⏱️ 16 хв."
2419,2024-06-15 06:22:23+00:00,"🔴 **Повітряна тривога❗️**
✈️ Зліт МіГ-31К

15.06.2024, 09:22"
2418,2024-06-14 23:44:33+00:00,"🟢 **Відбій повітряної тривоги!**

15.06.2024, 02:44:24 ⏱️ 30 хв."
2417,2024-06-14 23:14:19+00:00,"⚠УВАГА
🚨 Вся Україна - ракетна небезпека!
🛫 Зафіксовано зліт МіГ-31К з аеродрому Саваслейка (Нижньогородська область)."
2416,2024-06-14 23:14:07+00:00,"🔴 **Повітряна тривога❗️**
✈️ Зліт МіГ-31К

15.06.2024, 02:14"
2415,2024-06-14 12:11:53+00:00,"🟢 **Відбій повітряної тривоги!**

14.06.2024, 15:11:51 ⏱️ 21 хв."
2414,2024-06-14 11:50:54+00:00,"🔴 **Повітряна тривога❗️**
✈️ Зліт МіГ-31К

14.06.2024, 14:50"
2413,2024-06-14 07:43:46+00:00,"🟢 **Відбій повітряної тривоги!**

14.06.2024, 10:43:36 ⏱️ 25 хв."
2412,2024-06-14 07:27:34+00:00,"Попередньо чисто. 
Чекаємо відбою."
2411,2024-06-14 07:23:20+00:00,"⚠ Увага!
🚀 Ракетна небезпека по всій території України!"
2410,2024-06-14 07:22:21+00:00,Також з півночі кинджал / балістика на Київщину.
2409,2024-06-14 07:18:29+00:00,"🔴 **Повітряна тривога❗️**
Кинджал / балістика на Хмельниччину!

14.06.2024, 10:18:19"
2408,2024-06-14 03:47:45+00:00,"🟢 **Відбій повітряної тривоги!**

14.06.2024, 06:47:37 ⏱️ 44 хв."
2407,2024-06-14 03:02:55+00:00,"🔴 **Повітряна тривога❗️**
МіГ-31К пуски Кинджалів

14.06.2024, 06:02:53"
2406,2024-06-14 01:44:11+00:00,"🟢 **Відбій повітряної тривоги!**

14.06.2024, 04:44:06 ⏱️ 1 год. 39 хв."
2405,2024-06-14 00:05:05+00:00,"🔴 **Повітряна тривога❗️**
Ракетна небезпека 

14.06.2024, 03:04:55"
2404,2024-06-13 20:13:50+00:00,"**🤬 Зліт групи Ту-95мс з аеродрому ""Оленья"". **Очікується оголошення тривоги після 3:30."
2403,2024-06-12 03:48:00+00:00,"🟢 **Відбій повітряної тривоги!**

12.06.2024, 06:47:51 ⏱️ 32 хв."
2402,2024-06-12 03:15:55+00:00,"🔴 **Повітряна тривога❗️**
✈️ Зліт МіГ-31К

12.06.2024, 06:15:44"
2401,2024-06-12 01:45:43+00:00,"🟢 **Відбій повітряної тривоги!**

12.06.2024, 04:45:40 ⏱️ 1 год. 20 хв."
2400,2024-06-12 00:27:50+00:00,"UPD: Київщина
Ракети на Сумщині! Курс - західний! ~~Ймовірно Львівщина.~~"
2399,2024-06-12 00:25:24+00:00,"🔴 **Повітряна тривога❗️**
Небезпека ракетного удару КР ТУ-95МС

12.06.2024, 03:25:16"
2398,2024-06-07 01:55:27+00:00,"🟢 **Відбій повітряної тривоги!**

07.06.2024, 04:55:26 ⏱️ 1 год. 31 хв."
2397,2024-06-07 00:23:42+00:00,"🔴 **Повітряна тривога❗️**


07.06.2024, 03:23:36"
2396,2024-06-06 21:18:55+00:00,"Активність Ту-95.
Ймовірний початок тривоги після 3:30."
2395,2024-06-05 13:10:19+00:00,"🟢 **Відбій повітряної тривоги!**

05.06.2024, 16:10:16 ⏱️ 33 хв."
2394,2024-06-05 12:36:42+00:00,"🔴 **Повітряна тривога❗️**


05.06.2024, 15:36:32"
2393,2024-06-05 10:39:57+00:00,"🟢 **Відбій повітряної тривоги!**

05.06.2024, 13:39:54 ⏱️ 18 хв."
2392,2024-06-05 10:21:42+00:00,"🔴 **Повітряна тривога❗️**
✈️ Зліт МіГ-31К

05.06.2024, 13:21:34"
2391,2024-06-05 04:42:56+00:00,"🟢 **Відбій повітряної тривоги!**

05.06.2024, 07:42:46 ⏱️ 28 хв."
2390,2024-06-05 04:14:33+00:00,"🔴 **Повітряна тривога❗️**
✈️ Зліт МіГ-31К

05.06.2024, 07:14:30"
2389,2024-06-04 19:16:04+00:00,"🟢 **Відбій повітряної тривоги!**

04.06.2024, 22:15:59 ⏱️ 29 хв."
2388,2024-06-04 18:46:50+00:00,"🔴 **Повітряна тривога❗️**
✈️ Зліт МіГ-31К

04.06.2024, 21:46"
2387,2024-06-01 10:21:26+00:00,"**Цієї ночі підрозділи Повітряного командування «Захід» знищили над Львівською областю 16 крилатих ракет Х-101/Х-555 та «Калібр» і 4 ударних БпЛА типу «Shahed-131/136».

Величезна вдячність за таку потужну бойову роботу. Слава!**"
2386,2024-06-01 05:56:02+00:00,"⚡️ ЗБИТО 35 РАКЕТ ТА 46 УДАРНИХ БПЛА
➖➖➖➖➖➖➖➖➖➖
У ніч на 1 червня 2024 року російські окупанти завдали потужного ракетно-авіаційного удару по об’єктах критичної інфраструктури в різних регіонах України, застосувавши ракети повітряного, морського та наземного базування, а також ударні БпЛА типу «Shahed».

❗️ Усього ворог випустив 53 ракети різних типів та 47 ударних БпЛА:
- 35 крилатих ракет Х-101/Х-555 із літаків стратегічної авіації Ту-95 МС (район пусків – Саратовська обл., повітряний простір над акваторією Каспійського моря – рф.);
- 4 балістичні ракети «Іскандер-М» (із Криму);
- 1 крилату ракету «Іскандер-К» (із Криму);
- 10 крилатих ракет «Калібр» (із північно-східної частини акваторії Чорного моря);
- 3 керовані авіаційні ракети Х-59/Х-69 (із повітряного простору ТОТ Запорізької області);
- 47 ударних БпЛА типу «Shahed-131/136» (район пусків Приморсько-Ахтарськ – рф).

💥 До відбиття повітряного нападу противника залучено винищувальну авіацію, зенітні ракетні підрозділи Повітряних Сил, мобільні вогневі групи та засоби радіоелектронної боротьби Сил оборони України.

🔥 В результаті протиповітряного бою збито 81 повітряну ціль:
- 30 крилатих ракет Х-101/Х-555;
- 4 крилаті ракети «Калібр»;
- 1 крилату ракету «Іскандер-К»; 
- 46 ударних БпЛА типу «Shahed-131/136».

Російські терористи не полишають намірів знищити паливно-енергетичний сектор держави. Повітряні Сили та Сили оборони України роблять усе можливе, аби ворог не досяг своїх цілей на кожній ділянці фронту.
Дякую усім підрозділам протиповітряної оборони, хто уночі відбивав ракетний удар.

🇺🇦 Тримаймо стрій і разом – до перемоги!
➖➖➖➖➖➖➖➖➖➖
🇺🇦 Командувач Повітряних Сил генерал-лейтенант Микола Олещук"
2385,2024-06-01 05:55:29+00:00,"🟢 **Відбій повітряної тривоги!**

01.06.2024, 08:55:24 ⏱️ 15 хв."
2384,2024-06-01 05:39:36+00:00,"🔴 **Повітряна тривога❗️**
✈️ Зліт МіГ-31К

01.06.2024, 08:39"
2383,2024-06-01 03:10:55+00:00,"🟢 **Відбій повітряної тривоги!**

01.06.2024, 06:10:49 ⏱️ 2 год. 41 хв."
2382,2024-06-01 01:56:03+00:00,Залишки КР – Стрий  / Бурштин
2381,2024-06-01 01:45:01+00:00,"Ракети у напрямку Львова!
Перебувайте в укриттях."
2380,2024-06-01 01:37:58+00:00,"Маневри груп КР на Закарпатті, Франківщині, Тернопільщині, Львівщині з кінцевим курсом на Стрийщину + ймовірно Бурштин."
2379,2024-06-01 01:31:23+00:00,"Калібри + Х-101  з ТУ-95 синхронізувались у повітряному просторі Львівщини та сусідніх областей. 

Будьмо уважні! 
Стрийщина!"
2377,2024-06-01 00:30:34+00:00,Пуски Калібрів з Моря. Нічка буде комбінована.
2376,2024-06-01 00:29:44+00:00,"🔴 **Повітряна тривога❗️**


01.06.2024, 03:29:34"
2375,2024-05-31 19:24:42+00:00,"🔮 Нічка  буде тривожна ближче 4 ранку. 
Зліт ворожого страт.авіа ТУ-95М."
2374,2024-05-31 02:15:40+00:00,"🟢 **Відбій повітряної тривоги!**

31.05.2024, 05:15:39 ⏱️ 14 хв."
2373,2024-05-31 02:01:08+00:00,"🔴 **Повітряна тривога❗️**


31.05.2024, 05:01:02"
2372,2024-05-30 02:13:45+00:00,"🟢 **Відбій повітряної тривоги!**

30.05.2024, 05:13:40 ⏱️ 1 год. 15 хв."
2371,2024-05-30 00:57:53+00:00,"🔴 **Повітряна тривога❗️**


30.05.2024, 03:57:45"
2370,2024-05-29 15:01:57+00:00,"🟢 **Відбій повітряної тривоги!**

29.05.2024, 18:01:50 ⏱️ 27 хв."
2369,2024-05-29 14:34:25+00:00,"🔴 **Повітряна тривога❗️**
✈️ Зліт МіГ-31К

29.05.2024, 17:34"
2368,2024-05-28 17:32:06+00:00,"🟢 **Відбій повітряної тривоги!**

28.05.2024, 20:31:58 ⏱️ 14 хв."
2367,2024-05-28 17:18:05+00:00,"🔴 **Повітряна тривога❗️**
✈️ Зліт МіГ-31К

28.05.2024, 20:17"
2366,2024-05-26 07:46:42+00:00,"🟢 **Відбій повітряної тривоги!**

26.05.2024, 10:46:41 ⏱️ 21 хв."
2365,2024-05-26 07:24:54+00:00,"🔴 **Повітряна тривога❗️**
✈️ Зліт МіГ-31

26.05.2024, 10:24"
2364,2024-05-26 06:47:03+00:00,"🟢 **Відбій повітряної тривоги!**

26.05.2024, 09:46:56 ⏱️ 31 хв."
2363,2024-05-26 06:15:38+00:00,"🔴 **Повітряна тривога❗️**
✈️ Зліт МіГ-31К ае Саваслейка 

26.05.2024, 09:15"
2362,2024-05-26 02:21:37+00:00,"🟢 **Відбій повітряної тривоги!**

26.05.2024, 05:21:32 ⏱️ 1 год. 50 хв."
2361,2024-05-26 01:37:19+00:00,❇️❇️❇️
2360,2024-05-26 01:33:39+00:00,Івано-Франківськ в укриття Кинджал
2359,2024-05-26 01:30:14+00:00,"""Кинджал"" у напрямку Старкон. 
КР маневрують у тому ж напрямку."
2358,2024-05-26 01:22:51+00:00,✈️ Зафіксовано зліт МіГ-31К з аеродрому Саваслейка (Нижньогородська область).
2357,2024-05-26 01:16:18+00:00,🇵🇱 підняли тактичну авіацію 🙏  F-16
2356,2024-05-26 01:13:45+00:00,"UPD: КР змінили курс у напрямку сусідніх областей.

Ракетна небезпека для Львівщини! 
Група крилатих ракет через Тернопільщину курсом на Львів!"
2355,2024-05-26 00:45:02+00:00,"У повітрі близько 5х бортів Ту-95МС з ае ""Оленья"". 
Відбулися пуски, перші крилаті ракети зайшли з півночі через Чернігівську область у напрямку Київщини та далі на захід. 

03:45 Житомирщина

Ймовірно, у підвищеній небезпеці обʼєкти енергетичної та транспортної інфраструктури  західних та центральних областей."
2354,2024-05-26 00:30:36+00:00,"🔴 **Повітряна тривога❗️**
Ракетна небезпека для західних областей!

26.05.2024, 03:30:34"
2353,2024-05-24 19:59:32+00:00,"🟢 **Відбій повітряної тривоги!**

24.05.2024, 22:59:23 ⏱️ 28 хв."
2352,2024-05-24 19:30:58+00:00,"🔴 **Повітряна тривога❗️**
✈️ Зліт МіГ-31К

24.05.2024, 22:30"
2351,2024-05-24 17:46:33+00:00,"🟢 **Відбій повітряної тривоги!**

24.05.2024, 20:46:24 ⏱️ 26 хв."
2350,2024-05-24 17:19:41+00:00,"🔴 **Повітряна тривога❗️**
✈️ Зліт МіГ-31К

24.05.2024, 20:19"
2349,2024-05-24 10:46:51+00:00,"🟢 **Відбій повітряної тривоги!**

24.05.2024, 13:46:44 ⏱️ 19 хв."
2348,2024-05-24 10:27:35+00:00,"🔴 **Повітряна тривога❗️**
✈️ Зліт МіГ-31К

24.05.2024, 13:27"
2347,2024-05-22 21:47:42+00:00,"🟢 **Відбій повітряної тривоги!**

23.05.2024, 00:47:35 ⏱️ 19 хв."
2346,2024-05-22 21:28:09+00:00,"🔴 **Повітряна тривога❗️**
✈️ Зліт МіГ-31К

23.05.2024, 00:27"
2345,2024-05-22 06:53:38+00:00,"🟢 **Відбій повітряної тривоги!**

22.05.2024, 09:53:34 ⏱️ 20 хв."
2344,2024-05-22 06:33:08+00:00,"🔴 **Повітряна тривога❗️**


22.05.2024, 09:33:02"
2343,2024-05-20 18:10:04+00:00,"🟢 **Відбій повітряної тривоги!**

20.05.2024, 21:09:57 ⏱️ 32 хв."
2342,2024-05-20 17:37:53+00:00,"🔴 **Повітряна тривога❗️**
✈️ Зліт МіГ-31К з Астрахані!

20.05.2024, 20:37:40"
2341,2024-05-20 15:50:09+00:00,"🟢 **Відбій повітряної тривоги!**

20.05.2024, 18:49:55 ⏱️ 35 хв."
2340,2024-05-20 15:35:05+00:00,"🔪 пуск через Сумщину у центр, південь"
2339,2024-05-20 15:23:37+00:00,"Можливі пуски ""Кинджалів""! Зафіксовано зліт 6х МіГ-31К
Саваслейка - 4, Астрахань - 2."
2338,2024-05-20 15:14:53+00:00,"🔴 **Повітряна тривога❗️**

✈️ Зліт 2x МіГ-31К

20.05.2024, 18:14:41"
2337,2024-05-20 07:31:17+00:00,"🟢 **Відбій повітряної тривоги!**

20.05.2024, 10:31:08 ⏱️ 31 хв."
2336,2024-05-20 06:59:20+00:00,"🔴 **Повітряна тривога❗️**
✈️ Зліт МіГ-31К ае Саваслейка

20.05.2024, 09:59"
2335,2024-05-20 03:05:45+00:00,"🟢 **Відбій повітряної тривоги!**

20.05.2024, 06:05:42 ⏱️ 1 год. 6 хв."
2334,2024-05-20 01:59:29+00:00,"🔴 **Повітряна тривога❗️**
Загроза ударних БпЛА

20.05.2024, 04:59"
2333,2024-05-20 01:25:10+00:00,"🟢 **Відбій повітряної тривоги!**

20.05.2024, 04:25:01 ⏱️ 1 год. 28 хв."
2332,2024-05-19 23:56:44+00:00,"🔴 **Повітряна тривога❗️**
Загроза ударних БпЛА

20.05.2024, 02:56"
2331,2024-05-19 16:07:11+00:00,"🟢 **Відбій повітряної тривоги!**

19.05.2024, 19:07:08 ⏱️ 17 хв."
2330,2024-05-19 15:49:33+00:00,"🔴 **Повітряна тривога❗️**
Балістика 

19.05.2024, 18:49:23"
2329,2024-05-13 14:09:31+00:00,"🟢 **Відбій повітряної тривоги!**

13.05.2024, 17:09:30 ⏱️ 25 хв."
2328,2024-05-13 13:44:37+00:00,"🔴 **Повітряна тривога❗️**
✈️ Зліт МіГ-31К

13.05.2024, 16:44:24"
2327,2024-05-13 12:34:46+00:00,"🟢 **Відбій повітряної тривоги!**

13.05.2024, 15:34:33 ⏱️ 43 хв."
2326,2024-05-13 11:51:04+00:00,"🔴 **Повітряна тривога❗️**
**UPD: 5 бортів у повітрі.**

✈️ Зліт 2x МіГ-31К ае Саваслейка

13.05.2024, 14:50:57"
2325,2024-05-13 10:25:36+00:00,"🟢 **Відбій повітряної тривоги!**

13.05.2024, 13:25:35 ⏱️ 31 хв."
2324,2024-05-13 09:54:20+00:00,"🔴 **Повітряна тривога❗️**
✈️ Зліт МіГ-31К ае Саваслейка

13.05.2024, 12:54"
2323,2024-05-12 07:15:09+00:00,"🟢 **Відбій повітряної тривоги!**

12.05.2024, 10:15:08 ⏱️ 28 хв."
2322,2024-05-12 06:47:19+00:00,"🔴 **Повітряна тривога❗️**
✈️ Зліт МіГ-31К ае Саваслейка

12.05.2024, 09:47"
2321,2024-05-11 08:33:48+00:00,"🟢 **Відбій повітряної тривоги!**

11.05.2024, 11:33:36 ⏱️ 39 хв."
2320,2024-05-11 08:06:43+00:00,Робота ребами з півночі. Тривога триває.
2319,2024-05-11 07:54:29+00:00,"🔴 **Повітряна тривога❗️**
Загроза балістики 🚀

11.05.2024, 10:54"
2318,2024-05-08 06:47:19+00:00,"**Попередньо, на Львівщині було збито 8 з 12 ворожих ракет. Дякуємо нашим оборонцям неба!**"
2317,2024-05-08 06:40:58+00:00,"**Ворог атакував два обʼєкти критичної енергетичної інфраструктури у Львівській області. **

📍Сьогодні, 08.05.2024, близько 5 години ранку, окупанти влучили крилатими ракетами в обʼєкт генерації енергії у Червоноградському районі. Є два осередки загоряння. На місці працюють вогнеборці. Залучили спецтехніку. Загрози для людей, які живуть поблизу, немає.

📍Також через влучання poсійcькoї paкети постраждав обʼєкт критичної енергетичної інфраструктури у Стрийському районі. 

📍Під час повторної повітряної тривоги, яку оголосили у нашій області о 06:27, окупант атакував Львівщину «кинджалами». Критична та житлова інфраструктура не постраждали.

Станом на цю годину у нашій області обійшлося без жертв і потерпілих.

Усі системи життєзабезпечення Львівщини працюють у штатному режимі.

Інформація може оновлюватися."
2316,2024-05-08 06:35:40+00:00,"⚡️ ЗНИЩЕНО 59 ПОВІТРЯНИХ ЦІЛЕЙ: 39 РАКЕТ ТА 20 УДАРНИХ БПЛА
➖➖➖➖➖➖➖➖➖➖
У ніч на 8 травня 2024 року російські окупанти завдали комбінованого удару ракетами різних типів та ударними БпЛА. 

Загалом ворог застосував 76 засобів повітряного нападу – 55 ракет та 21 ударний безпілотник:
- 1 аеробалістичну ракету Х-47М2 «Кинджал» (пуск із Тамбовської обл. – рф.);
- 2 балістичні ракети «Іскандер-М» (із ТОТ Криму);
- 4 крилаті ракети «Калібр» (із акваторії Чорного моря); 
- 45 крилатих ракет Х-101/Х-555 із літаків стратегічної авіації Ту-95 МС (район пусків Саратовська обл. – рф., акваторія Каспійського моря);
- 1 крилату ракети «Іскандер-К» (із Криму);
- 2 керовані авіаційні ракети Х-59/Х-69 (із окупованої Запорізької обл.);
- 21 ударний БпЛА типу «Shahed-131/136» (із районів Приморсько-Ахтарськ, Курська обл. - рф.).

💥 До відбиття повітряного нападу противника залучено винищувальну авіацію, зенітні ракетні війська Повітряних Сил, мобільні вогневі групи та підрозділи радіоелектронної боротьби Сил оборони України.

В результаті протиповітряного бою знищено 59 повітряних цілей:
- 33 крилаті ракети Х-101/Х-555;
- 4 крилаті ракети «Калібр»;
- 2 керовані авіаційні ракети Х-59/Х-69;
- 20 ударних БпЛА типу «Shahed-131/136».

Противник продовжує завдавати ударів по об’єктах критичної інфраструктури України та інших важливих стратегічних об’єктах.  Я дякую усім, хто сьогодні доклав максимум зусиль, аби ворог не досяг своїх цілей.

❗️Сьогодні 8 травня, в Україні відзначається День пам'яті та перемоги над нацизмом у Другій світовій війні. Вшановуємо полеглих тієї страшної війни, вшановуємо українських героїв сучасності, які цього разу боронять рідну землю від рашизму!   

🇺🇦 Разом – до перемоги!
➖➖➖➖➖➖➖➖➖➖
🇺🇦  Командувач Повітряних Сил генерал-лейтенант Микола Олещук"
2315,2024-05-08 03:55:30+00:00,"🟢 **Відбій повітряної тривоги!**

08.05.2024, 06:55:21 ⏱️ 28 хв."
2314,2024-05-08 03:33:02+00:00,Пуск кинжалу . Стрий ❗️❗️❗️
2313,2024-05-08 03:30:30+00:00,✈️ Зліт МіГ-31К (бойовий)
2312,2024-05-08 03:26:55+00:00,"🔴 **Повітряна тривога❗️**


08.05.2024, 06:26:48"
2311,2024-05-08 03:04:13+00:00,"🟢 **Відбій повітряної тривоги!**

08.05.2024, 06:04:12 ⏱️ 2 год. 11 хв."
2310,2024-05-08 00:53:20+00:00,"🔴 **Повітряна тривога❗️**


08.05.2024, 03:53:10"
2309,2024-05-07 20:25:16+00:00,"Попередньо відбувся зліт кількох Ту-95мс. Якщо виліт бойовий, очікуємо ракети у повітряному просторі України ~04:00 - 05:00."
2308,2024-05-03 19:34:46+00:00,"🟢 **Відбій повітряної тривоги!**

03.05.2024, 22:34:36 ⏱️ 50 хв."
2307,2024-05-03 18:43:45+00:00,"🔴 **Повітряна тривога❗️**
✈️ Зліт МіГ-31К ае Саваслейка

03.05.2024, 21:43:39"
2306,2024-05-03 17:54:09+00:00,"🟢 **Відбій повітряної тривоги!**

03.05.2024, 20:54:01 ⏱️ 18 хв."
2305,2024-05-03 17:35:52+00:00,"🔴 **Повітряна тривога❗️**
✈️ Зліт МіГ-31К ае Саваслейка

03.05.2024, 20:35:40"
2304,2024-05-03 16:06:02+00:00,"🟢 **Відбій повітряної тривоги!**

03.05.2024, 19:05:51 ⏱️ 30 хв."
2303,2024-05-03 15:35:09+00:00,"🔴 **Повітряна тривога❗️**
✈️ Зліт МіГ-31К

03.05.2024, 18:35:00"
2302,2024-05-03 12:33:03+00:00,"🟢 **Відбій повітряної тривоги!**

03.05.2024, 15:32:57 ⏱️ 25 хв."
2301,2024-05-03 12:07:51+00:00,"🔴 **Повітряна тривога❗️**
✈️ Зліт МіГ-31К

03.05.2024, 15:07"
2300,2024-04-27 03:02:28+00:00,"🟢 **Відбій повітряної тривоги!**

27.04.2024, 06:02:18 ⏱️ 2 год. 3 хв."
2299,2024-04-27 00:58:42+00:00,"🔴 **Повітряна тривога❗️**


27.04.2024, 03:58:39"
2298,2024-04-26 21:06:56+00:00,Підтверджений виліт Ту-95МС та запуск шахедів. КР у повітряному просторі очікується не раніше 4 ранку.
2297,2024-04-26 21:00:43+00:00,"🟢 **Відбій повітряної тривоги!**

27.04.2024, 00:00:38 ⏱️ 1 год. 2 хв."
2296,2024-04-26 20:37:02+00:00,Кинджали вектором на західні області.
2295,2024-04-26 20:19:02+00:00,✈️ Зліт МіГ-31К
2293,2024-04-26 20:01:42+00:00,"Калібри з Чорного моря. Напрямок західний. Вже на Вінниччині. Якщо курс незмінний, ~ 30 хв Львів."
2292,2024-04-26 19:58:44+00:00,"🔴 **Повітряна тривога❗️**
Загроза ракетного удару!

26.04.2024, 22:58"
2291,2024-04-25 14:16:46+00:00,"🟢 **Відбій повітряної тривоги!**

25.04.2024, 17:16:35 ⏱️ 31 хв."
2289,2024-04-25 13:44:39+00:00,"🔴 **Повітряна тривога❗️**
✈️ Зліт МіГ-31К

25.04.2024, 16:44"
2288,2024-04-25 11:25:22+00:00,**🟢 All Clear!**
2287,2024-04-25 10:54:20+00:00,✈️ Зліт МіГ-31К
2286,2024-04-25 07:29:27+00:00,"🔴 **Повітряна тривога❗️**
✈️ Зліт МіГ-31К

25.04.2024, 10:29"
2285,2024-04-20 10:45:26+00:00,"🟢 **Відбій повітряної тривоги!**

20.04.2024, 13:45:25 ⏱️ 26 хв."
2284,2024-04-20 10:18:34+00:00,"🔴 **Повітряна тривога❗️**
✈️ Зліт МіГ-31К

20.04.2024, 13:18"
2283,2024-04-19 03:15:11+00:00,"🟢 **Відбій повітряної тривоги!**

19.04.2024, 06:15:06 ⏱️ 1 год. 18 хв."
2282,2024-04-19 02:17:54+00:00,"На заході наразі спокійно.

 Основний удар припав на Полтавську, Дніпропетровську та Одеську області."
2281,2024-04-19 01:56:52+00:00,"🔴 **Повітряна тривога❗️**
Загроза ракетного удару

19.04.2024, 04:56"
2280,2024-04-18 20:22:16+00:00,"🔮 Нічка буде тривожною! 
**Зафіксовано 6х Ту-95МС курсом з «Оленья» на пускові рубежі «Енгельс» / Каспій**"
2279,2024-04-12 16:56:25+00:00,"🟢 **Відбій повітряної тривоги!**

12.04.2024, 19:56:16 ⏱️ 19 хв."
2278,2024-04-12 16:36:50+00:00,"🔴 **Повітряна тривога❗️**
✈️ Зліт 2x МіГ-31К ае Саваслейка

12.04.2024, 19:36"
2277,2024-04-11 06:19:49+00:00,"⚡️ ЗНИЩЕНО 57 ПОВІТРЯНИХ ЦІЛЕЙ: 18 РАКЕТ ТА 39 УДАРНИХ БПЛА
➖➖➖➖➖➖➖➖➖➖
У ніч на 11 квітня 2024 року російські окупанти завдали комбінованого удару ракетами різних типів та ударними БпЛА. Основний напрямок – Львівщина.

Загалом ворог застосував 82 засоби повітряного нападу:
🚀 20 крилатих ракет Х-101/Х-555 із літаків стратегічної авіації Ту-95 МС (район пусків – Саратовська обл. -рф.);
🚀 6 аеробалістичних ракет Х-47М2 «Кинджал» з винищувачів МіГ-31К (район пусків – Тамбовська область -рф.);
☄️  12 зенітних керованих ракет С-300 (пуски із Бєлгородської обл. - рф.);
🛵  40 ударних БпЛА типу «Shahed-131/136» (із районів Приморсько-Ахтарськ - рф., Чауда – Крим).
🚀 4 керовані авіаційні ракети Х-59 (із повітряного простору окупованої Запорізької обл.).

💥  До відбиття повітряного нападу противника залучено винищувальну авіацію та зенітні ракетні війська Повітряних Сил, мобільні вогневі групи та підрозділи радіоелектронної боротьби Сил оборони України.

В результаті протиповітряного бою знищено 57 повітряних цілей:
🚀 16 крилатих ракет Х-101/Х-555;
🛵 39 ударних БпЛА типу «Shahed-131/136»;
🚀 2 керовані авіаційні ракети Х-59.

Дякую усім захисникам неба, хто цієї ночі відбивав чергову терористичну атаку окупантів.
🇺🇦 Разом – до перемоги!
➖➖➖➖➖➖➖➖➖➖
🇺🇦  Командувач Повітряних Сил генерал-лейтенант Микола Олещук"
2276,2024-04-11 03:49:52+00:00,"🟢 **Відбій повітряної тривоги!**

11.04.2024, 06:49:49 ⏱️ 3 год. 12 хв."
2275,2024-04-11 00:37:21+00:00,"🔴 **Повітряна тривога❗️**
Загроза масованого ракетного удару

11.04.2024, 03:37"
2274,2024-04-09 02:36:15+00:00,"🟢 **Відбій повітряної тривоги!**

09.04.2024, 05:36:14 ⏱️ 2 год. 43 хв."
2273,2024-04-08 23:52:54+00:00,"🔴 **Повітряна тривога❗️**
Загроза шахедів

09.04.2024, 02:52:52"
2272,2024-04-08 11:05:09+00:00,"🟢 **Відбій повітряної тривоги!**

08.04.2024, 14:05:06 ⏱️ 41 хв."
2271,2024-04-08 10:23:41+00:00,"🔴 **Повітряна тривога❗️**


08.04.2024, 13:23:29"
2270,2024-04-08 10:23:20+00:00,✈️ Зліт МіГ-31К
2269,2024-04-06 03:18:01+00:00,"🟢 **Відбій повітряної тривоги!**

06.04.2024, 06:17:56 ⏱️ 1 год. 28 хв."
2268,2024-04-06 01:49:09+00:00,"🔴 **Повітряна тривога❗️**


06.04.2024, 04:49:01"
2267,2024-04-05 15:00:57+00:00,"🟢 **Відбій повітряної тривоги!**

05.04.2024, 18:00:52 ⏱️ 1 год. 27 хв."
2266,2024-04-05 13:33:37+00:00,"🔴 **Повітряна тривога❗️**
✈️ Зліт МіГ-31К

05.04.2024, 16:33"
2265,2024-04-04 17:04:59+00:00,"🟢 **Відбій повітряної тривоги!**

04.04.2024, 20:04:56 ⏱️ 28 хв."
2264,2024-04-04 16:36:11+00:00,"🔴 **Повітряна тривога❗️**
✈️ Зліт МіГ-31К ае Саваслейка

04.04.2024, 19:36"
2263,2024-03-31 03:27:51+00:00,"🟢 **Відбій повітряної тривоги!**

31.03.2024, 06:27:50 ⏱️ 1 год. 26 хв."
2262,2024-03-31 03:15:01+00:00,Львів чисто.
2261,2024-03-31 03:01:45+00:00,"Ракети у напрямку Стрия з півночі та півдня!


Активність тактичної авіації НАТО у польському повітряному просторі."
2260,2024-03-31 02:55:01+00:00,транзитом у напрямку Стрийського району ‼️‼️‼️‼️
2259,2024-03-31 02:54:14+00:00,у напрямку Львова з півночі!
2258,2024-03-31 02:48:08+00:00,Через Львів транзитом у напрямку Стрийського району ‼️
2256,2024-03-31 02:44:33+00:00,Будьмо уважні❗️
2255,2024-03-31 02:41:39+00:00,КР у напрямку Львівщини!
2254,2024-03-31 02:41:39+00:00,"❗️Львів ~ 5 хв 

Загроза по ракетах — Рівненська, Волинська, Львівська, Тернопільська, Івано-Франківська."
2253,2024-03-31 02:30:29+00:00,Курс західний.  ~ 20 хв до Львова.
2252,2024-03-31 02:01:28+00:00,"🔴 **Повітряна тривога❗️**
Крилаті ракети з курської обл. рф на Сумщину → Чернігівщину  →  Київщину! Курс - західний.

31.03.2024, 05:01:17"
2251,2024-03-30 22:26:33+00:00,"**🟡  Зверніть увагу: сьогодні вночі о 3:00 за Києвом відбувається перехід на годину вперед на літній час. **


Зважаючи на підтверджений виліт** групи Ту-95мс у напрямку **пускових** рубежів, очікуємо загрозу масованого ракетного удару ** ~ 4:30-06:30.


Зарядіть гаджети, наберіть води, лягайте спати поки є кілька годин до тривоги."
2250,2024-03-29 11:07:30+00:00,"⚡️ ЗНИЩЕНО 84 ПОВІТРЯНІ ЦІЛІ: 58 «ШАХЕДІВ» і 26 РАКЕТ
➖➖➖➖➖➖➖➖➖➖➖➖
У ніч на 29 березня 2024 року противник завдав потужного ракетного-авіаційного удару по об’єктах паливно-енергетичного сектору України, застосувавши різні типи ракет та ударні БпЛА: 

Усього – 99 засобів повітряного нападу:

⚠️ 60 ударних БпЛА типу «Shahed-136/131» (район пусків Приморсько-Ахтарськ, Курська область -рф.);
❗ 3 аеробалістичні ракети Х-47М2 «Кинджал» (із трьох винищувачів МіГ-31К – Рязанська область -рф.);
❗ 2 балістичні ракети «Іскандер-М» (ТОТ Крим);
❗ 9 керованих авіаційних ракет Х-59 (із дев’яти літаків Су-34 – Бєлгородська область);
❗ 4 крилаті ракети «Іскандер-К» (Курська область -рф);
❗ 21 крилата ракета Х-101/Х-555 (із одинадцяти стратегічних бомбардувальників Ту-95МС – Енгельс -рф.).

💥 До відбиття ракетно-авіаційного удару залучено зенітні ракетні підрозділи Повітряних Сил та Сухопутних військ, мобільні вогневі групи, засоби радіоелектронної боротьби Сил оборони України.

В результаті протиповітряного бою знищено 84 повітряні цілі:

⚠️ 58 ударних БпЛА типу «Shahed-136/131»;
❗ 17 крилатих ракет Х-101/Х-555;
❗ 5 керовані авіаційні ракети Х-59;
❗ 4 крилаті ракети «Іскандер-К».

Честь і хвала усім, хто захищає Україну від російського терору.
Дякую за бойову роботу, дякую за результат!

🇺🇦 Разом – до перемоги!
➖➖➖➖➖➖➖➖➖➖➖
🇺🇦  Командувач Повітряних Сил генерал-лейтенант Микола Олещук"
2249,2024-03-29 04:13:52+00:00,"По Х**•**101 🇲🇩 MD 05:25
Несмішно."
2248,2024-03-29 04:09:00+00:00,"🟢 **Відбій повітряної тривоги!**

29.03.2024, 06:08:55 ⏱️ 3 год. 56 хв."
2247,2024-03-29 03:20:38+00:00,"**__05:35 по КР чисто. __**

⚠️ Львів, уважно.
КР з Рівненщини →  через Львівщину → на Франківщину."
2246,2024-03-29 03:17:07+00:00,"Поки чисто. Але КР у сусідніх областях: Рівненська, Тернопільська, Франківська."
2245,2024-03-29 03:08:33+00:00,КР з Волині на Львівщину!
2244,2024-03-29 02:52:24+00:00,"__5:01 по Кинджалам чисто.__

⚠️ Зліт 3х МіГ-31К, пуски Кинджалів!
у бік Київщини/Житомирщини → на Хмельницьк.
Другий Кинджал на Хмельницьк → Тернопіль.
→ Стрийський район."
2243,2024-03-29 02:32:52+00:00,"БпЛА у Стрийському районі.
Група КР у напрямку Вінницької області!"
2242,2024-03-29 01:46:56+00:00,"☑️ БпЛА наразі чисто. 
Щось ще долітає з Тернопільщини – Вінниччини.

Ту-95мс здійснили пуски ракет.
__Розрахунковий час підльоту 04:30 — 05:00__"
2241,2024-03-29 00:43:06+00:00,🛵 Ударний БпЛА у напрямку Стрийського району Львівщини.
2240,2024-03-29 00:12:55+00:00,"🔴 **Повітряна тривога❗️**
Загроза ударних БПЛА

29.03.2024, 02:12"
2239,2024-03-28 22:31:31+00:00,"Схоже, ранок буде тривожним. 
Підтверджений виліт групи Ту-95мс.
До 4:30 - 5:00 маєте ще можливість поспати.
Не забудьте, поставити гаджети на зарядку."
2238,2024-03-28 16:34:56+00:00,"🟢 **Відбій повітряної тривоги!**

28.03.2024, 18:34:48 ⏱️ 31 хв."
2237,2024-03-28 16:03:51+00:00,"🔴 **Повітряна тривога❗️**
✈️ зліт МіГ-31К ае Саваслейка

28.03.2024, 18:03"
2236,2024-03-28 11:09:13+00:00,"🟢 **Відбій повітряної тривоги!**

28.03.2024, 13:09:05 ⏱️ 59 хв."
2235,2024-03-28 10:09:42+00:00,"🔴 **Повітряна тривога❗️**
✈️ зліт 2x МіГ-31К ае Саваслейка

28.03.2024, 12:09:38"
2234,2024-03-26 18:04:22+00:00,
2233,2024-03-26 18:02:11+00:00,"Ракета, яка пролетіла над Польщею, була однією з тих, що цілилися на найбільше в Україні Дашавське газосховище у Стрийському районі. Ці ракети летіли з Курської та Брянської областей РФ, а з окупованого українського Півдня в бік Дашави прямували ""шахеди"". Як це було 23 і 24 березня - [**дивіться**](https://texty.org.ua/fragments/112086/nadskladni-trayektoriyi-yak-letily-shahedy-i-rakety-pid-chas-masovanyh-atak-2324-bereznya-karta/) на мапі"
2232,2024-03-26 18:02:10+00:00,Трохи світла на події минулого тижня.
2231,2024-03-25 16:13:22+00:00,"🟢 **Відбій повітряної тривоги!**

25.03.2024, 18:13:21 ⏱️ 29 хв."
2230,2024-03-25 16:13:20+00:00,📢 Відбій загрози балістики по всій території України
2229,2024-03-25 16:08:31+00:00,"Наразі чисто, проте залишаємося в укриттях до відбою. 
Між Львовом та Кримом лише ~ 7 хв."
2228,2024-03-25 16:02:44+00:00,"Суб'єктивна думка: реальні можливості нових ракет ЗМ22 ""Циркон"" - значно менші, ніж були оголошені. Так, вони гіперзвукові (понад 100 км/хв), тому на загрозу балістики потрібно реагувати миттєво (!) Проте наразі можливо говорити з певним сумнівом про дальність понад 700 км, при задекларованій 1000 км."
2227,2024-03-25 15:43:37+00:00,"🔴 **Повітряна тривога❗️**
Балістика з Криму

25.03.2024, 17:43:26"
2226,2024-03-24 13:51:05+00:00,"⚡️ ЗНИЩЕНО 43 ПОВІТРЯНІ ЦІЛІ: 18 РАКЕТ ТА 25 УДАРНИХ БПЛА
➖➖➖➖➖➖➖➖➖➖➖➖
У ніч на 24 березня 2024 року російські окупанти атакували 29-ма крилатими ракетами Х-101/Х-555 із 14 літаків стратегічної авіації Ту-95МС (район пусків Енгельс – рф.) та 28-ма ударними БпЛА типу «Shahed» (райони пусків Приморсько-Ахтарськ - рф., мис Чауда – Крим).

До відбиття повітряного нападу залучались зенітні ракетні підрозділи та винищувальна авіація Повітряних Сил, мобільні вогневі групи, засоби радіоелектронної боротьби Сил оборони України.

💥 В результаті протиповітряного бою знищено 43 повітряні цілі: 18 крилатих ракет Х-101/Х-555 та 25 ударних БпЛА «Shahed-136/131» у межах Дніпропетровської, Херсонської, Миколаївської, Одеської, Сумської, Київської, Волинської та Львівської областей.

Усім дякую за бойову роботу!
🇺🇦 Разом – до перемоги!
➖➖➖➖➖➖➖➖➖➖➖➖
🇺🇦  Командувач Повітряних Сил генерал-лейтенант Микола Олещук"
2225,2024-03-24 13:51:05+00:00,"Сьогодні вночі на захід країни було здійснено комбіновану масовану атаку у кілька етапів. Першою хвилею після 3 ночі залетіли 7/28 ворожих ударних безпілотників, наступною після 5 ранку – 19/29 крилатих ракет. Згодом після 9 ранку ворог з 2х бортів МіГ-31К вдарив по Львівщині «Кинджалами»."
2224,2024-03-24 07:58:47+00:00,"🟢 **Відбій повітряної тривоги!**

24.03.2024, 09:58:39 ⏱️ 27 хв."
2223,2024-03-24 07:31:31+00:00,"🔴 **Повітряна тривога❗️**
🔪 МіГ-31к

24.03.2024, 09:31"
2222,2024-03-24 04:07:17+00:00,"🟢 **Відбій повітряної тривоги!**

24.03.2024, 06:07:15 ⏱️ 2 год. 38 хв."
2221,2024-03-24 04:01:49+00:00,🍀Очікуємо незабаром ВІДБІЙ.
2220,2024-03-24 03:44:05+00:00,"⚠️ Львів увага! 
КР крізь Львів у напрямку на Стрий."
2219,2024-03-24 02:01:41+00:00,"**UPD 4:10 по шахедам чисто! **
**Крилаті ракети з Ту-95мс у кілька хвиль **заходять **через Сумщину в західному напрямку.**

На Львівщину залетіло кілька шахедів. Часто змінюють курс. Маскимальна увага у Стрийському, Дрогобицькому районах."
2218,2024-03-24 01:32:14+00:00,"Тривога у звʼязку із загрозою ударних БПЛА. 
Напрямок руху на Стрийщину.
Також зафіксовано пуски крилатих ракет з 14х бортів ТУ-95мс. Очікувана ракетна небезпека ~ 4:30-05:30."
2217,2024-03-24 01:28:45+00:00,"🔴 **Повітряна тривога❗️**


24.03.2024, 03:28:34"
2216,2024-03-23 23:40:20+00:00,"**🟡 Активність Ту-95мс, у повітрі понад 10х бортів. **
**Очікуване оголошення тривоги** ~ 4:30-05:30.


🛵 дирчики вже на заході, у Житомирській, Хмельницькій. Ймовірно, не становитимуть небезпеку для Львівщини до того ж часу."
2215,2024-03-22 15:15:49+00:00,
2214,2024-03-22 15:15:48+00:00,
2213,2024-03-22 15:15:48+00:00,
2212,2024-03-22 15:15:48+00:00,
2211,2024-03-22 15:15:48+00:00,"**Важливі поради, які рятують життя!**

📣 «Повітряна тривога» може застати вас де завгодно, але не завжди є можливість добігти до укриття. Як убезпечити себе в такому випадку👆

Пам’ятайте: сигнал «Повітряна тривога» з різних причин може не лунати. Натомість ви можете побачити сповіщення в телефоні, почути радіоповідомлення чи звуки вибухів.

📍Радимо заздалегідь проговорити з близькими порядок дій і визначити місце зустрічі на випадок, якщо зникне зв’язок або світло. Також рекомендуємо завантажити карти місцевості, які будуть доступними без Інтернету.

🆘 [Сайт](https://dsns.gov.ua/) • [Fb](https://www.facebook.com/MNS.GOV.UA) • [Tw](https://twitter.com/SESU_UA) • [Insta](https://www.instagram.com/dsns_ukraine/) • [YouTube](https://www.youtube.com/user/MNSgovUA)"
2210,2024-03-22 11:42:04+00:00,"⚡️ ЗНИЩЕНО 92 ПОВІТРЯНІ ЦІЛІ: 55 «ШАХЕДІВ» і 37 РАКЕТ
➖➖➖➖➖➖➖➖➖➖➖➖
У ніч на 22 березня 2024 року противник завдав комбінованого ракетного-авіаційного удару по об’єктах критичної інфраструктури України. 

❗️Усього ворог застосував 151 засіб повітряного нападу:

- 63 ударні БпЛА типу «Shahed-136/131» (район пусків Приморсько-Ахтарськ – рф.);
- 12 балістичних ракет «Іскандер-М» (Белгородська область - рф., ТОТ Крим);
- 40 крилатих ракет Х-101/Х-555 (із тринадцяти стратегічних бомбардувальників Ту-95МС – акваторія Каспійського моря);
- 5 крилатих ракет Х-22 (із п’яти бомбардувальників Ту-22М3 – Ростовська обл. -рф.);
- 7 аеробалістичних ракет Х-47М2 «Кинджал» (із десяти МіГ-31К– Тамбовська область -рф.);
- 2 керовані авіаційні ракети Х-59 (із двох Су-30 (Су-34) – ТОТ Запорізької області);
- 22 зенітні керовані ракети С-300/С-400 (Белгородська, Курська обл. - рф.).

До відбиття ракетно-авіаційного удару залучено зенітні ракетні підрозділи Повітряних Сил та Сухопутних військ, мобільні вогневі групи, засоби радіоелектронної боротьби Сил оборони України.

💥 В результаті протиповітряного бою знищено 92 повітряні цілі:
- 55 ударних БпЛА типу «Shahed-136/131»;
- 35 крилатих ракет Х-101/Х-555;
- 2 керовані авіаційні ракети Х-59.

Усім дякую за бойову роботу!
Тримаймо небо!
🇺🇦 Разом – до перемоги!
➖➖➖➖➖➖➖➖➖➖➖➖
🇺🇦  Командувач Повітряних Сил генерал-лейтенант Микола Олещук"
2209,2024-03-22 04:59:23+00:00,"🟢 **Відбій повітряної тривоги!**

22.03.2024, 06:59:22 ⏱️ 4 год. 27 хв."
2208,2024-03-22 04:22:52+00:00,"Підсумки будуть згодом, але вже очевидно, цієї ночі країна пережила одну з наймасованіших комбінованих ракетних атак. 

Пік загрози минув, проте все ще можуть бути поодинокі крилаті ракети у повітрі країни.

Триває небезпека балістики у всіх областях.
Триває небезпека Кинджалів у всіх областях."
2207,2024-03-22 04:16:10+00:00,Поки чисто.
2206,2024-03-22 04:11:23+00:00,⚠️ Львів
2204,2024-03-22 04:09:20+00:00,✈️ зліт 3х МіГ-31К ае Саваслейка
2203,2024-03-22 04:04:01+00:00,"Хороша новина – більшість ракет з ТУ-95МС вже утилізовано. 
Погана – ті, що залишились, більшість у нашій зоні."
2202,2024-03-22 03:59:49+00:00,**Крилаті ракети на Івано-Франківщині змінили курс на Львівщину!**
2201,2024-03-22 03:57:11+00:00,"Кинджал у напрямку Хмельниччини.
Ракети на Житомирщині курсом на Львів.
+5 хв."
2200,2024-03-22 03:47:24+00:00,"Знову ✈️ зліт 2х МіГ-31К ае Саваслейка.
КР вже на Тернопільщині, курс західний."
2199,2024-03-22 03:41:00+00:00,"⚠️ Львів, прокидаємося! Ракетна небезпека!!!"
2198,2024-03-22 03:36:24+00:00,Перші крилаті ракети залетіли у Вінницьку область →  Хмельницька і далі на захід.
2197,2024-03-22 03:20:23+00:00,🛬 Зафіксовано зліт ще двох МіГ-31К з аеродрому Саваслейка Нижньогородської області.
2196,2024-03-22 03:14:35+00:00,"Звуки, які чути у місті, це робота безстрашних львіських комунальників. Крилаті ракети поки не досягнули повітряного простору західних областей."
2195,2024-03-22 02:45:10+00:00,"Перші ракети залітають у повітряний простір країни. 
+ ✈️ зліт 2х МіГ-31К ае Саваслейка"
2193,2024-03-22 01:36:29+00:00,"**UPD: Пуски у дві хвилі здійснили всі 13 бортів Ту-95мс (6 з Оленя, 7 з Енгельса).

**Попередньо: зафіксовано пуски крилатих ракет з літаків Ту-95МС. Це щось нове, два дні поспіль активна страт авіа."
2192,2024-03-22 01:30:45+00:00,"🛵 дирчики летять хвилями через Хмельницьку  →  Тернопільську  →  у Львівську / Франківську. Перша група вже загубилась. На підльоті наступні, вектор руху → Стрийщина → Франківщина."
2191,2024-03-22 01:01:50+00:00,🔮 Висока ймовірність тривоженьки ближче ранку
2190,2024-03-22 01:01:50+00:00,"Після 5 ранку очікуємо також ракетну небезпеку. Активна стратегічна авіація ТУ-95МС, кількість бортів у небі збільшується."
2189,2024-03-22 01:00:46+00:00,"Перша група шахедів залетіла у Львівську область. Наразі вектор руху не на Львів, а ближче Франківщини."
2188,2024-03-22 00:31:37+00:00,"🔴 **Повітряна тривога❗️**
Загроза ударних БпЛА

22.03.2024, 02:31"
2187,2024-03-21 04:10:28+00:00,"🟢 **Відбій повітряної тривоги!**

21.03.2024, 06:10:28 ⏱️ 2 год. 26 хв."
2186,2024-03-21 02:47:57+00:00,"Ракети постійно змінюють курс, наразі у повітряному просторі Житомирщини та Рівненщини. 

Львівщина поки спокійно."
2185,2024-03-21 02:41:21+00:00,✈️ зліт МіГ-31К
2184,2024-03-21 02:38:48+00:00,⚠️ Ракети у напрямку Львівщини
2183,2024-03-21 01:57:24+00:00,"UPD: 4:02 зайшли через Сумську область, курс південно-західний. 

Тривогу оголосили раніше розрахунку. Перша група ракет на підльоті до кордонів країни.

11 бортів Ту-95мс надалі в районі пускових рубежів, очікується кілька хвиль ракетної атаки."
2182,2024-03-21 01:43:58+00:00,"🔴 **Повітряна тривога❗️**
Небезпека масованого ракетного удару!

21.03.2024, 03:43:45"
2181,2024-03-20 23:06:16+00:00,"🔮 Очікуємо оголошення тривоги після 4:30.
Існує загроза масованого ракетного ближче до ранку. Підтвердженні вильоти бортів Ту-95мс у напрямку пускових рубежів Енгельса / Каспію."
2180,2024-03-20 23:06:16+00:00,"Традиційно рекомендуємо подбати про зарядку смартфонів, павербанків та інших гаджетів, запасу технічної та питної води."
2179,2024-03-19 14:53:27+00:00,"🟢 **Відбій повітряної тривоги!**

19.03.2024, 16:53:24 ⏱️ 44 хв."
2178,2024-03-19 14:08:49+00:00,"🔴 **Повітряна тривога❗️**
✈️ зліт МіГ-31К ае Саваслейка

19.03.2024, 16:08:42"
2177,2024-03-18 14:14:14+00:00,"🟢 **Відбій повітряної тривоги!**

18.03.2024, 16:14:09 ⏱️ 13 хв."
2176,2024-03-18 14:01:01+00:00,"🔴 **Повітряна тривога❗️**
✈️ зліт МіГ-31К

18.03.2024, 16:00"
2175,2024-03-17 20:40:01+00:00,"🟢 **Відбій повітряної тривоги!**

